,created,user_location,tweet_text,username,all_hashtags,refine_text,text_length
0,11/9/2020 4:49,Gotham City ,b'Look at #SRH youngster Priyam Garg after Kane Williamson masterclass 50 last night \xf0\x9f\xa4\xa8  Forget about moving his A$$ look at his behavior \xf0\x9f\x98\xa1  Really is this guy groomed under great Rahul Dravid ?  Virat Kohli 2.0 loading in terms of shittiness for sure   #SRHvDC #DCvSRH #IPL2020 https://t.co/Zi3wWUwZwn',b'SteadyTheShip',"['SRH', 'SRHvDC', 'DCvSRH', 'IPL2020']",look youngster priyam garg kane williamson masterclass last night forget moving look behavior really guy groomed great rahul dravid virat kohli loading term shittiness sure,40
1,11/9/2020 4:49,"Bengaluru South, India",b'This is Mr.360\xc2\xb0 @ABdeVilliers17 . Most dangerous Animal in cricket \xf0\x9f\x98\x80.  #Cricket #IPL2020 #Eliminater #IPLQualifier #Dhoni #RCBvsSRH #IPlFinal2020 #SouthAfrica #ABDevilliers @OfficialCSA @ICC @BCCI @imVkohli #ViratKohli @RCBTweets @StarSportsIndia #SelectDougout #IPLSIXES https://t.co/lvgkiDw1F4',b'imsapien',"['Cricket', 'IPL2020', 'Eliminater', 'IPLQualifier', 'Dhoni', 'RCBvsSRH', 'IPlFinal2020', 'SouthAfrica', 'ABDevilliers', 'ViratKohli', 'SelectDougout', 'IPLSIXES']",mrxcxb dangerous animal cricket,9
2,11/9/2020 4:48,"Chennai, India ","b""Great things happen to those who don't stop believing, trying, learning, and being grateful !\xf0\x9f\x99\x8f  Happy Morning \xf0\x9f\x8c\xb7  @ImRo45 \xf0\x9f\x92\x99 @mipaltan \xf0\x9f\x91\x8d  #RohitSharma #MumbaiIndians #IPL2020 #IPLfinal #MondayMotivation #Believe \xf0\x9f\x91\x8a https://t.co/SOU7xG3QV7""",b'CricketGirl_45',"['RohitSharma', 'MumbaiIndians', 'IPL2020', 'IPLfinal', 'MondayMotivation', 'Believe']",great thing happen dont stop believing trying learning grateful happy morning,21
3,11/9/2020 4:48,"Chennai, India",b'T Natarajan made a mark with his yorkers in #IPL2020 \xf0\x9f\x91\x8c  Will we see him play T20Is for India soon? https://t.co/bFsT2S3fJ4',b'ESPNcricinfo',['IPL2020'],natarajan made mark yorkers xfxfxxc see play ti india soon,19
4,11/9/2020 4:47,"Kerala, India",b'#IPL2020 Final: Marcus Stoinis warning to @mipaltan...   . Check Out:- https://t.co/Hs5fRPXd3M . #iplseason13 #IPLfinal #MumbaiIndians #DelhiCapitals #DCvsMI #DCvMI #MIvDC #MI #YehHaiNayiDilli #MIvsDC',b'InsideSportIND',"['IPL2020', 'iplseason13', 'IPLfinal', 'MumbaiIndians', 'DelhiCapitals', 'DCvsMI', 'DCvMI', 'MIvDC', 'MI', 'YehHaiNayiDilli', 'MIvsDC']",marcus stoinis warning check,7
5,11/9/2020 4:47,NA,"b""I have seen some trollers trolling Rohit and Dhoni captaincy after Gautam Gambhir's comment. That whole team efforts makes captain great ! That's true no doubt but backing your cap &amp; uncap team mates in there bad times shows Rohit and Dhoni greatness as a captain ! \xf0\x9f\x99\x8f  #IPL2020""",b'archit0687',['IPL2020'],seen troller trolling rohit dhoni captaincy gautam gambhirs comment whole team effort make captain great thats true doubt backing cap uncap team mate bad time show rohit dhoni greatness captain,46
6,11/9/2020 4:47,India,b'#IPL2020 Final is set.   Four-time champions #MumbaiIndians vs first-time finalists #DelhiCapitals.   Will #MI extend their record or will we witness a new champion? https://t.co/wjNYJDHXCl',b'thefield_in',"['IPL2020', 'MumbaiIndians', 'DelhiCapitals', 'MI']",set fourtime champion v firsttime finalist extend record witness new champion,19
7,11/9/2020 4:46,NA,"b""Man of the Match in IPL finals:  2013-Kieron Pollard 2015-Rohit Sharma 2017-Krunal Pandya 2019-Jasprit Bumrah  And all 4 will play in tomorrow's final! Maintaining the core is one of the biggest reason for this team's success\xf0\x9f\x92\x99 #Mi #MumbaiIndians #OneFamily  #IPL2020 #MIvDC""",b'__r_a_h_u_l___',"['Mi', 'MumbaiIndians', 'OneFamily', 'IPL2020', 'MIvDC']",man match final kieron pollard rohit sharma krunal pandya jasprit bumrah play tomorrow maintaining core one biggest reason team successxfxfxx,35
8,11/9/2020 4:46,Global,"b'@SunRisers Thanks for the another year of grit, grace, strength and entertainment @SunRisers  #OrangeArmy #SRH #SunrisersHyderabad #IPL2020 @davidwarner31 #Hyderabad'",b'sriniarcher',"['OrangeArmy', 'SRH', 'SunrisersHyderabad', 'IPL2020', 'Hyderabad']",thanks another year grit grace strength entertainment,11
9,11/9/2020 4:46,"Ponnamaravathi, India","b'2017 RCB released Watson, in 2018 he made finals &amp; won with CSK, 2018 RCB released DeKock, in 2019 he made finals &amp; won with MI, 2019 RCB released Stoinis &amp; Hetmyer and now they have made the finals with DC  \xe0\xa4\x86\xe0\xa4\xb0\xe0\xa4\xb8\xe0\xa5\x80\xe0\xa4\xac\xe0\xa5\x80 \xe0\xa4\xab\xe0\xa5\x81\xe0\xa4\xb2 \xe0\xa4\xaa\xe0\xa4\xa8\xe0\xa5\x8c\xe0\xa4\xa4\xe0\xa5\x80 \xe0\xa4\xb9\xe0\xa5\x88 #IPL2020'",b'The_Kafir_boy',['IPL2020'],rcb released watson made final csk rcb released dekock made final mi rcb released stoinis hetmyer made final dc xexaxxexaxbxexaxbxexaxxexaxacxexax xexaxabxexaxxexaxb xexaxaaxexaxaxexaxcxexaxaxexax xexaxbxexax,40
10,11/9/2020 4:45,"Chennai, India",b'Inshallah boys played well . #DCvsSRH #IPL2020 #Eliminator #Dream11IPL #DelhiCapitals',b'kishanrp7',"['DCvsSRH', 'IPL2020', 'Eliminator', 'Dream11IPL', 'DelhiCapitals']",inshallah boy played well,4
11,11/9/2020 4:45,NA,"b'I Just Wish @DelhiCapitals takes away the #IPL2020, for sheer dedication and quality it has brought to the table.'",b'GautamLata1',['IPL2020'],wish take away sheer dedication quality brought table,17
12,11/9/2020 4:45,NA,"b'Head to head in last 5 games, Mumbai leads 4-1  MI vs DC Dream11 predictions: https://t.co/VHO3J9cBni  #Cricket #FantasyCricket #Dream11IPL #Dream11 #Dream11Team #Dream11Tips #Dream11IPLMIvDC #MIvDC #MIvsDC #MumbaiIndians #DelhiCapitals #IPL2020 #IPL2020Final #FantasyTeams'",b'ReadScoops',"['Cricket', 'FantasyCricket', 'Dream11IPL', 'Dream11', 'Dream11Team', 'Dream11Tips', 'Dream11IPLMIvDC', 'MIvDC', 'MIvsDC', 'MumbaiIndians', 'DelhiCapitals', 'IPL2020', 'IPL2020Final', 'FantasyTeams']",head head last game mumbai lead mi v dc dream prediction,13
13,11/9/2020 4:44,NA,b'IPL Final 2020: Delhi Capitals coach Ricky Ponting thrilled as team maiden title clash https://t.co/UEddrO0wPY #ipl2020 #delhicapitals #rickyponting #shreyasiyer #cricket #ipl #kagisorabada #marcusstoinis #mumbaiindians',b'mykhelcom',"['ipl2020', 'delhicapitals', 'rickyponting', 'shreyasiyer', 'cricket', 'ipl', 'kagisorabada', 'marcusstoinis', 'mumbaiindians']",delhi capital coach ricky ponting thrilled team maiden title clash,13
14,11/9/2020 4:44,Wherever Superkings Play,b'@YUVSTRONG12 poked fun at @yuzi_chahal for RCB getting knocked out of the #IPL2020.  @RCBTweets @IPL @BCCI @imVkohli #IPLinUAE #IPL2020final  #Crictoday #CricketToday #CricketTodayMagazine  https://t.co/RK7xOrWoBu',b'crictoday',"['IPL2020', 'IPLinUAE', 'IPL2020final', 'Crictoday', 'CricketToday', 'CricketTodayMagazine']",poked fun rcb getting knocked,10
15,11/9/2020 4:43,India,b'Weldon DC @SDhawan25 #IPL2020 https://t.co/NYfxUvgj6c',b'chetans1987',['IPL2020'],weldon dc,2
16,11/9/2020 4:43,"Vellore, India",b'Even though #csk did not qualified but the craze for  @msdhoni  is overwhelming \xf0\x9f\x92\x9b\xf0\x9f\x94\xa5 The most exciting player of ipl 2020:#MSDhoni @msdhoni  #csk #IPL2020 #ThalaDhoni A strong comeback is expected \xf0\x9f\x94\xa5\xf0\x9f\x98\x8e #ipl2021 https://t.co/V3PMAPhgMg',b'MRPDK_07',"['csk', 'MSDhoni', 'csk', 'IPL2020', 'ThalaDhoni', 'ipl2021']",even though qualified craze overwhelming xfxfxxbxfxfxxa exciting player strong comeback expected xfxfxxaxfxfxxe,24
17,11/9/2020 4:43,Vizag,b'I hope Delhi Wins. #IPL2020',b'praasaadd',['IPL2020'],hope delhi win,4
18,11/9/2020 4:42,Asia,"b'Well done Team #DelhiCapitals for making it to the first-ever #IPL2020 final, well deserved! @KagisoRabada25 @MStoinis @SDhawan25 and captain @ShreyasIyer15 deserve credit for this win tonight #DCvSRH  Many congrats... And beat wishes for the final #Dream_Final #MIvDC'",b'vijay_tiwari1',"['DelhiCapitals', 'IPL2020', 'DCvSRH', 'Dream_Final', 'MIvDC']",well done team making firstever well deserved captain deserve credit win tonight many congrats beat wish,28
19,11/9/2020 4:42,GOC,b'If #mi beat #DelhiCapitals in finals of #IPL2020 they will equal the record of #CSK to defeat a same team four times in same season. #CSK defeated #SRH four times in #ipl2018.   @DelhiCapitals @mipaltan @IPL @cricbuzz',b'sandeepdbhat',"['mi', 'DelhiCapitals', 'IPL2020', 'CSK', 'CSK', 'SRH', 'ipl2018']",beat final equal record defeat team four time season defeated four time,25
20,11/9/2020 4:42,"Chennai, India",b'Feeling sad??  Just think about #KaneWilliamson IND U-19 vs NZ U-19 Runners up AUS vs NZ 2015 WC finals- Runners up CSK vs SRH 2018 #IPL final- Runners up ENG vs NZ 2019 WC finals- Runners up DC vs SRH 2020 IPL semi final- Eliminated.\xf0\x9f\x92\x94 #Cricket #SRH #IPL2020 #IPLfinal #respect',b'imankitmishraa',"['KaneWilliamson', 'IPL', 'Cricket', 'SRH', 'IPL2020', 'IPLfinal', 'respect']",feeling sad think ind v nz runner au v nz wc final runner csk v srh runner eng v nz wc final runner dc v srh semi eliminatedxfxfxx,39
21,11/9/2020 4:42,💙,b'@KaizerChiefs &amp;  @orlandopirates now this jus made my morning \xf0\x9f\x98\x82\xf0\x9f\x98\x85\xf0\x9f\xa4\x9e 2pac of Soccer #FIFA21 #KaizerChiefs #OrlandoPirates #ChampionsLeague #dcfc #GNTAND #GOT7_BreathofLove_LastPiece #IPL2020 #Iqbal #Khosi4Life #kasiangempi #leadership https://t.co/QuaPtjG2Rj',b'FMenwana',"['FIFA21', 'KaizerChiefs', 'OrlandoPirates', 'ChampionsLeague', 'dcfc', 'GNTAND', 'GOT7_BreathofLove_LastPiece', 'IPL2020', 'Iqbal', 'Khosi4Life', 'kasiangempi', 'leadership']",jus made morning xfxfxxxfxfxxxfxfxaxe pac soccer,11
22,11/9/2020 4:41,"Chennai, India",b'We all missed him in #IPL2020 .\xf0\x9f\x98\x94 https://t.co/9LfTiqVKlA',b'Ritesh_7l',['IPL2020'],missed,6
23,11/9/2020 4:41,Piliippatti,b'Team of the tournament by Tom Moddy @IPL #IPL2020   \xf0\x9f\x91\x89Ishan Kishan makes to the team   1. S Dhawan - DC 2. KL Rahul - KXIP 3. S Yadav - MI 4. ABD* - RCB 5. I Kishan - MI 6. R Tewatia - RR 7. R Khan* - SRH 8. J Archer* - RR 9. K Rabada* - DC 10. Y Chahal - RCB 11. J Bumrah - MI',b'Ishan_kishanFan',['IPL2020'],team tournament tom moddy xfxfxxishan kishan make team dhawan dc kl rahul kxip yadav mi abd rcb kishan mi tewatia rr khan srh archer rr k rabada dc chahal rcb bumrah mi,45
24,11/9/2020 4:40,NA,b'According to a report in Indian Express: Varun Chakravarthy has a labrum tear in his shoulder that doesn\xe2\x80\x99t affect his bowling but hinders his throwing. It\xe2\x80\x99s an injury that he has had for a while but has aggravated as the #IPL2020 progressed. @BCCI  #IPL #Cricket',b'CricSidd',"['IPL2020', 'IPL', 'Cricket']",according report indian express varun chakravarthy labrum tear shoulder doesnxexxt affect bowling hinders throwing itxexxs injury aggravated progressed,41
25,11/9/2020 4:40,"Hyderabad, India","b'#IPL2020 Final #MIvsDC @MyTeam_11 Prediction: @mipaltan vs @DelhiCapitals Probable XI, Fantasy Playing Tips... . See Here:- https://t.co/Zk6gs1uM3J . #iplseason13 #IPLfinal #MumbaiIndians #DelhiCapitals #DCvsMI #DCvMI #MIvDC #MI #YehHaiNayiDilli #MIvsDC'",b'InsideSportIND',"['IPL2020', 'MIvsDC', 'iplseason13', 'IPLfinal', 'MumbaiIndians', 'DelhiCapitals', 'DCvsMI', 'DCvMI', 'MIvDC', 'MI', 'YehHaiNayiDilli', 'MIvsDC']",prediction v probable xi fantasy playing tip see,10
26,11/9/2020 4:40,India. AP. ,b'Congratulations For Your 1st IPL final.   @DelhiCapitals #DC #DelhiCapitals #DCvsSRH  #IPL2020 |#IPLfinal',b'VanzarePratik',"['DC', 'DelhiCapitals', 'DCvsSRH', 'IPL2020', 'IPLfinal']",congratulation st,6
27,11/9/2020 4:40,"Saket, New Delhi","b'People are taking Dhawan might be winning the orange cap this year. Dude you know na? Finals are against the Mumbai Indians, first over VS Trent boult. He will go for duck! so chill @klrahul11 nobody gonna take your cap. \xf0\x9f\x98\x89\xf0\x9f\x98\x82  #IPL2020 #IPLfinal'",b'naseemakram100',"['IPL2020', 'IPLfinal']",people taking dhawan might winning orange cap year dude know na final mumbai indian first v trent boult go duck chill nobody gonna take cap xfxfxxxfxfxx,40
28,11/9/2020 4:39,Junagadh,"b""Dude @absycric dig any of jofra's tweets regarding IPL 2020 winner  #IPL2020 #DCvsMI @JofraArcher""",b'nalorepedharedy',"['IPL2020', 'DCvsMI']",dude dig jofras tweet regarding winner,9
29,11/9/2020 4:39,NA,b'#IPL2020 | Delhi Capitals beat Sunrisers Hyderabad by 17 runs; will face Mumbai Indians in Finals on Tuesday.   Final Score:   #DC-   189/3 (20)  #SRH - 172/8 (20)  #SRHvsDC | #DCvSRH #\xe0\xb0\x9c\xe0\xb0\xbf\xe0\xb0\xad\xe0\xb0\xbe\xe0\xb0\xb5\xe0\xb0\xb5\xe0\xb0\xb0\xe0\xb0\x82 \xe0\xb0\x9c\xe0\xb0\xbf.\xe0\xb0\xad\xe0\xb0\xbe\xe0\xb0\xb5\xe0\xb0\xb5\xe0\xb0\xb0\xe0\xb0\x82 https://t.co/CZviCVMQbH',b'GBhavavaram',"['IPL2020', 'DC', 'SRH', 'SRHvsDC', 'DCvSRH', 'జిభావవరం']",delhi capital beat sunrisers hyderabad run face mumbai indian final tuesday score xexbxcxexbxbfxexbxadxexbxbexexbxbxexbxbxexbxbxexbx xexbxcxexbxbfxexbxadxexbxbexexbxbxexbxbxexbxbxexbx,19
30,11/9/2020 4:39,"New Delhi, India",b'Leaked image of Marcus Stoinis from a Wrestling ring in Australia...\xf0\x9f\x90\x90  Hulk for Delhi capital. Beast. #DCvSRH #DCvMI  #ipl2020 https://t.co/sN4JOIJZ03',b'tuktuk_lover',"['DCvSRH', 'DCvMI', 'ipl2020']",leaked image marcus stoinis wrestling ring australiaxfxfxx hulk delhi capital beast,16
31,11/9/2020 4:39,"Chennai, India","b'Many congratulations @DelhiCapitals for entering into the finals,Top performances were @SDhawan25 #MarcusStoinis #hetymer @KagisoRabada251\xf0\x9f\x91\x8f\xf0\x9f\x8f\xbb. Hard-Luck @SunRisers \xf0\x9f\x91\x8d\xf0\x9f\x8f\xbb\xf0\x9f\xa7\xa1 #SRH #DelhiCapitals #DCvsSRH #IPL2020 https://t.co/MmnlUigP6j'",b'NishanRai_',"['MarcusStoinis', 'hetymer', 'SRH', 'DelhiCapitals', 'DCvsSRH', 'IPL2020']",many congratulation entering finalstop performance xfxfxxfxfxfxfxbb hardluck xfxfxxdxfxfxfxbbxfxfxaxa,12
32,11/9/2020 4:39,Sri Lanka,"b""Alright! Kane Williamson. That's the tweet. #IPL2020""",b'MaskaaPaav',['IPL2020'],alright kane williamson thats tweet,6
33,11/9/2020 4:38,NA,"b""Isn't tat a no ball \xf0\x9f\x99\x84\xf0\x9f\x99\x84 #DCvSRH #IPL2020 https://t.co/H1lDMutFU4""",b'Praveen_raina_',"['DCvSRH', 'IPL2020']",isnt tat ball xfxfxxxfxfxx,6
34,11/9/2020 4:38,Nomad in South India,b'2nd November = SRK Birthday Next Day #KKR Out Of #IPL2020  5th November = Virat Birthday Next Day #RCB Out Of #IPL2020  9th November = #PrithviShaw Birthday 10th November #Mi VS #DC Final  9Th November = #TejashwiYadav Birthday  10th November #BiharElections2020 Result',b'FaizanAkhlakh2',"['KKR', 'IPL2020', 'RCB', 'IPL2020', 'PrithviShaw', 'Mi', 'DC', 'TejashwiYadav', 'BiharElections2020']",nd november srk birthday next day november virat birthday next day november birthday november v november birthday november result,29
35,11/9/2020 4:38,NA,b'This is gonna be some final! #IPL2020 https://t.co/cYzKPpqIbq',b'thePatronus_',['IPL2020'],gonna,6
36,11/9/2020 4:37,NA,b'@joy_ebike Delhi Capitals  will win match   #IPLContest2020 #IPL2020  #JoyEbike @joy_ebike',b'Vinay4023',"['IPLContest2020', 'IPL2020', 'JoyEbike']",delhi capital win match,5
37,11/9/2020 4:37,NA,"b""All credit to excellently knitted @DelhiCapitals management. The planning and executions' for past couple of years have been phenomenal. #IPL2020 #IPLfinal #DCvsMI""",b'GautamLata1',"['IPL2020', 'IPLfinal', 'DCvsMI']",credit excellently knitted management planning execution past couple year phenomenal,18
38,11/9/2020 4:37,"Tirupati, India",b'Ipl is already ending?????? #IPL2020 #MIvsDC',b'aashkavora',"['IPL2020', 'MIvsDC']",already ending,4
39,11/9/2020 4:37,"New Delhi, India",b'#IPL2020: @DelhiCapitals reach first-ever @IPL final after beating #SRH by 17 runs; will play @mipaltan for IPL 2020 trophy... . Check Out:- https://t.co/FttESPrNmN . #iplseason13 #IPLfinal #DelhiCapitals #sunrisers #OrangeArmy #SRHvDC #DCvsSRH #KaneWilliamson',b'InsideSportIND',"['IPL2020', 'SRH', 'iplseason13', 'IPLfinal', 'DelhiCapitals', 'sunrisers', 'OrangeArmy', 'SRHvDC', 'DCvsSRH', 'KaneWilliamson']",reach firstever beating run play trophy check,14
40,11/9/2020 4:36,"Chennai, India","b'@bhogleharsha @DelhiCapitals In 2018,2019 ipl the final Playing teams met 4 times including 2 league matches, Q1 and finals.All the times winner was same. CSK beats SRH 4-0 in 2018 and MI beats CSK 4-0 in 2019 as well. In 2020,Till now MI Already beaten DC 3-0.Will MI follow d pattern? #IPL2020 #IPLfinal 1/2'",b'Imsreekanth7',"['IPL2020', 'IPLfinal']",playing team met time including league match q finalsall time winner csk beat srh mi beat csk well till mi already beaten dc mi follow pattern,42
41,11/9/2020 4:36,Oman  / Pakistan /Saudi Arabia,"b""Agree or not  It's   Mumbai Indians  vs  Delhi Capitals Delhi Super Kings Delhi Knight Riders Kings XI Delhi Sunrisers Delhi Delhi Royals Royal Challengers Delhi   On #IPL2020 final""",b'RP_Rajavell',['IPL2020'],agree mumbai indian v delhi capital delhi super king delhi knight rider king xi delhi sunrisers delhi delhi royal royal challenger delhi,27
42,11/9/2020 4:36,India,b'The only good thing happened to Delhi in a while is entering the finals. #IPL2020 #IPLfinal #IPL #DCvsMI',b'gumnaamsoch',"['IPL2020', 'IPLfinal', 'IPL', 'DCvsMI']",good thing happened delhi entering final,14
43,11/9/2020 4:36,India,b'Yes it was a great season for many reasons! But the most important thing that you guys can be proud of is that you are probably the only team in the IPL to back young talents and give them opportunity!  Kudos to the entire #OrangeArmy players and staffs for a terrific #IPL2020 \xf0\x9f\x91\x8f https://t.co/vruZIQYOtC',b'crikvoice',"['OrangeArmy', 'IPL2020']",yes great season many reason important thing guy proud probably team back young talent give opportunity kudos entire player staff terrific,51
44,11/9/2020 4:36,"New Delhi, India","b""It's time to select your team of the tournament, here's mine! @IPL #IPL2020   1. S Dhawan - DC 2. KL Rahul - KXIP 3. V Kohli - RCB 4. ABD\xe2\x9c\x88\xef\xb8\x8f - RCB 5. I Kishan - MI 6. R Tewatia - RR 7. R Khan\xe2\x9c\x88\xef\xb8\x8f - SRH 8. J Archer\xe2\x9c\x88\xef\xb8\x8f - RR 9. K Rabada\xe2\x9c\x88\xef\xb8\x8f - DC 10. Y Chahal - RCB 11. J Bumrah - MI""",b'YagnaSayz',['IPL2020'],time select team tournament here mine dhawan dc kl rahul kxip kohli rcb abdxexcxxefxbxf rcb kishan mi tewatia rr khanxexcxxefxbxf srh archerxexcxxefxbxf rr k rabadaxexcxxefxbxf dc chahal rcb bumrah mi,43
45,11/9/2020 4:35,Seventh Heaven,b'Who will be the winner of #Dream11IPL ?   #IPLT20 #IPL2020 #IPLfinal #mi #dc #MIvDC #Dubai #YehHaiNayiDilli',b'sajeeth_ahd',"['Dream11IPL', 'IPLT20', 'IPL2020', 'IPLfinal', 'mi', 'dc', 'MIvDC', 'Dubai', 'YehHaiNayiDilli']",winner,6
46,11/9/2020 4:35,"New Delhi, India",b'I had a feeling that if Williamson would have stayed he would have won the contest vs Rabada. #IPL2020',b'udit_buch',['IPL2020'],feeling williamson would stayed would contest v rabada,18
47,11/9/2020 4:35,NA,"b""When Stoinis channeled his inner Hulk and powered Delhi Capitals to a place they've never been to before.  @ganeshcee has more on the all-rounder's power-packed show.  #DC #MarcusStoinis #IPL2020""",b'cricbuzz',"['DC', 'MarcusStoinis', 'IPL2020']",stoinis channeled inner hulk powered delhi capital place theyve never allrounders powerpacked show,25
48,11/9/2020 4:35,london,b'#IPL2020 | Delhi Capitals beat Sunrisers Hyderabad by 17 runs; will face Mumbai Indians in Finals on Tuesday.   Final Score:   #DC-   189/3 (20)  #SRH - 172/8 (20)  #SRHvsDC | #DCvSRH #\xe0\xb0\xaa\xe0\xb1\x86\xe0\xb0\xa6\xe0\xb1\x8d\xe0\xb0\xa6\xe0\xb0\xbe\xe0\xb0\xaa\xe0\xb1\x81\xe0\xb0\xb0\xe0\xb0\xaa\xe0\xb1\x8d\xe0\xb0\xaa\xe0\xb0\xbe\xe0\xb0\xa1\xe0\xb1\x81 \xe0\xb0\xaa\xe0\xb1\x86\xe0\xb0\xa6\xe0\xb1\x8d\xe0\xb0\xa6\xe0\xb0\xbe\xe0\xb0\xaa\xe0\xb1\x81\xe0\xb0\xb0\xe0\xb0\xaa\xe0\xb1\x8d\xe0\xb0\xaa\xe0\xb0\xbe\xe0\xb0\xa1\xe0\xb1\x81 https://t.co/xbQhkZJ6lP',b'PGPanchayat',"['IPL2020', 'DC', 'SRH', 'SRHvsDC', 'DCvSRH', 'పెద్దాపురప్పాడు']",delhi capital beat sunrisers hyderabad run face mumbai indian final tuesday score xexbxaaxexbxxexbxaxexbxdxexbxaxexbxbexexbxaaxexbxxexbxbxexbxaaxexbxdxexbxaaxexbxbexexbxaxexbx xexbxaaxexbxxexbxaxexbxdxexbxaxexbxbexexbxaaxexbxxexbxbxexbxaaxexbxdxexbxaaxexbxbexexbxaxexbx,19
49,11/9/2020 4:34,"Saket, New Delhi",b'#IPL2020 Final: Top 5 reasons why @mipaltan can beat @DelhiCapitals to retain their IPL title... . See Here:- https://t.co/EU7p4X07K6 . #iplseason13 #IPLfinal #DelhiCapitals #MumbaiIndians #MI #SRHvDC #DCvsSRH #KaneWilliamson',b'InsideSportIND',"['IPL2020', 'iplseason13', 'IPLfinal', 'DelhiCapitals', 'MumbaiIndians', 'MI', 'SRHvDC', 'DCvsSRH', 'KaneWilliamson']",top reason beat retain title see,13
50,11/9/2020 4:34,"New Delhi, India",b'@R3Mitul  dream 11 tip for final ???? #IPL2020',b'dhamu_iam',['IPL2020'],dream tip,4
51,11/9/2020 4:33,"Chennai, India","b'#IPL2020 Finals: After hattrick of losses, can @DelhiCapitals get 4th time lucky against @mipaltan ? . See Here:- https://t.co/3rxXwaF7Yw . #iplseason13 #IPLfinal #DelhiCapitals #MumbaiIndians #MI #SRHvDC #DCvsSRH #KaneWilliamson'",b'InsideSportIND',"['IPL2020', 'iplseason13', 'IPLfinal', 'DelhiCapitals', 'MumbaiIndians', 'MI', 'SRHvDC', 'DCvsSRH', 'KaneWilliamson']",final hattrick loss get time lucky see,13
52,11/9/2020 4:33,"West Bengal, Bharat",b'@DSCcricket Biggest Wish to Win this Wonderful Cricket Gears.  Tq team @DSCcricket  #IPL2020 #DCvsMI #MIvsDC   Join us  @Barbiegirl0098 @buttter__cup  @imPalak18 @shubhamanyu @Sweetheartlubb @Tuaa74 @AbdurRa64684550 @mysterioussu @atashuddin  @prashpatel_ @AmbaMonika @Sagar14Naik @Sandeep13_',b'raj__0011',"['IPL2020', 'DCvsMI', 'MIvsDC']",biggest wish win wonderful cricket gear tq team join u,12
53,11/9/2020 4:33,"मुंबई, भारत","b'""Stoinis roared, arms in the air, fists clenched, veins popping in his granite forearms.""  Would Delhi Capitals be in the IPL final without him?   @the_kk delves into the allrounder\'s performance  https://t.co/Ckms0sLLpI #IPL2020'",b'andymcg_cricket',['IPL2020'],stoinis roared arm air fist clenched vein popping granite forearm would delhi capital without delf allrounders performance,29
54,11/9/2020 4:33,Kolkata,b'@ESPNcricinfo I feel even @BCCI should look beyond Virat Kohli if they want any ICC trophies in their cupboard #BCCI #Cricket #IPL2020',b'bhautik_pm',"['BCCI', 'Cricket', 'IPL2020']",feel even look beyond virat kohli want icc trophy cupboard,17
55,11/9/2020 4:32,"New Delhi, India",b'Bumrah and Natarajan are going to be a lethal pair. Hope to see them together in the Indian national team very soon. #IPL2020 Natarajan #SRHvsDC @BCCI',b'dheepjobgeo',"['IPL2020', 'SRHvsDC']",bumrah natarajan going lethal pair hope see together indian national team soon natarajan,23
56,11/9/2020 4:32,"Chennai, India",b'Last final game  Toss and match 2500 9119660591 \xf0\x9f\x92\xaf\xf0\x9f\x92\xaf\xf0\x9f\x92\xaf\xf0\x9f\x92\xaf\xf0\x9f\x92\xaf\xf0\x9f\x92\xaf\xf0\x9f\x92\xaf\xf0\x9f\x92\xaf\xf0\x9f\x92\xaf #IPL2020 #Dcvsmi #bettingpicks #match #cricket',b'TossCricket',"['IPL2020', 'Dcvsmi', 'bettingpicks', 'match', 'cricket']",last game toss match xfxfxxafxfxfxxafxfxfxxafxfxfxxafxfxfxxafxfxfxxafxfxfxxafxfxfxxafxfxfxxaf,7
57,11/9/2020 4:32,India,"b""#IPLfinal #IPL2020 #MIvDC #MI  If You're The Owner Of IPL Team, Who Is Your CAPTAIN\xf0\x9f\xa4\x94 Msd\xf0\x9f\x91\x8d Rohit\xf0\x9f\x94\x83  #rohitsharma45 #RohitSharma #IPLfinal  #OneFamily #MSDhoni https://t.co/YcMjp7U7s9""",b'Shikharai07',"['IPLfinal', 'IPL2020', 'MIvDC', 'MI', 'rohitsharma45', 'RohitSharma', 'IPLfinal', 'OneFamily', 'MSDhoni']",youre owner team captainxfxfxax msdxfxfxxd rohitxfxfxx,13
58,11/9/2020 4:32,NA,"b'""And here we are..\xf0\x9f\x8f\x8f\xe2\x99\xa5\xef\xb8\x8f #IPL2020  #MIvsDC https://t.co/OhlkAo4jcp'",b'Mayank_2807',"['IPL2020', 'MIvsDC']",arexfxfxfxfxexxaxefxbxf,4
59,11/9/2020 4:32,"New Delhi, India",b'#IPLFinal 2017: RPS v MI (3-1) 2018: CSK v SRH (4-0) 2019: CSK\xc2\xa0 v MI\xc2\xa0 (0-4) Will DC win in spite of those 3 losses as like MI did in 2017 ( vs RPS) ?  #MI #DC \xc2\xa0#IPL2020',b'RitwikNalla',"['IPLFinal', 'MI', 'DC', 'IPL2020']",rps mi csk srh cskxcxa mixcxa dc win spite loss like mi v rps,25
60,11/9/2020 4:31,Sri Lanka,b'Now IPL may have the new winning team or the defending champions. #IPL2020 for a reason.\xf0\x9f\xa4\xb7\xf0\x9f\x8f\xbb\xe2\x80\x8d\xe2\x99\x82\xef\xb8\x8f',b'Bhavesh_Patel25',['IPL2020'],may new winning team defending champion reasonxfxfxaxbxfxfxfxbbxexxdxexxxefxbxf,15
61,11/9/2020 4:30,"Tither, if not hither","b""Mumbai Indians - all IPL final wins have come batting 1st.  Rohit - has 1 more IPL win playing for Deccan Chargers 09 again batting 1st in finals.  DC has their own challenges w/chasing.   Hopefully this final isn't about batting 1st.  #IPL2020 #IPLfinal #IPL #MI #DelhiCapitals""",b'suubsy',"['IPL2020', 'IPLfinal', 'IPL', 'MI', 'DelhiCapitals']",mumbai indian win come batting st rohit win playing deccan charger batting st final dc challenge wchasing hopefully isnt batting st,37
62,11/9/2020 4:30,"London, England",b'Caption......   #IPL2020 https://t.co/Gp7sERTzgc',b'SKTHALA1055',['IPL2020'],caption,1
63,11/9/2020 4:30,"Toronto, Ontario",b'@ABDULSAMAD___1 last night batting superb bro ... Keep it up #DCvSRH  #SRH  #IPL2020',b'Manju_0501',"['DCvSRH', 'SRH', 'IPL2020']",last night batting superb bro keep,8
64,11/9/2020 4:30,NA,"b""With unlimited access to news and entertainment, get IPL updates in Mumbai with India's first animated newspaper for FREE!  Start your 30-day FREE TRIAL today! https://t.co/rLvn1W6d74 . . . . #MiddayDigitalTabloid #MiddayNews #MadeInMumbai  #COVID19 #IPL2020 #epaper #Freetrial https://t.co/eWccVvjnK4""",b'mid_day',"['MiddayDigitalTabloid', 'MiddayNews', 'MadeInMumbai', 'COVID19', 'IPL2020', 'epaper', 'Freetrial']",unlimited access news entertainment get update mumbai india first animated newspaper free start day free trial today,25
