,created,user_location,tweet_text,username,all_hashtags,refine_text,text_length
430,11/9/2020 2:26,"Varanasi, India","b""Finally after long wait @DelhiCapitals makes their way onto the #iplfinals now it's time to see the match between the #Financial capital vs the #national  capital \xf0\x9f\x98\x89\xf0\x9f\x98\x89#MIvsDC #IPL2020""",b'pramodk28862349',"['iplfinals', 'Financial', 'national', 'MIvsDC', 'IPL2020']",finally long wait make way onto time see match capital v capital xfxfxxxfxfxx,23
431,11/9/2020 2:26,world,"b""@ImRitika45 @ImRo45 @BCCI Oh.....Okay......I think @ImRo45 not in the form.....But he tries to hit boundaries by doing Impossible shots......May be he's play very well for this #IPL2020 ........#MIvsDC""",b'UrstruelyBapuji',"['IPL2020', 'MIvsDC']",ohokayi think formbut try hit boundary impossible shotsmay he play well,22
432,11/9/2020 2:25,"Ranchi, India","b'final Match #IPL2020  Tuesday, 10 November 2020 07:30pm Indian time \xe2\x8c\x9a  #MI #OneFamily #Dream11IPL #IPLinUAE #IPL2020playoffs #UnacademyAskTheExperts #AltrozSuperStriker #Cricket #DelhiCapitals #YehHaiNayiDilli'",b'Rafroz17',"['IPL2020', 'MI', 'OneFamily', 'Dream11IPL', 'IPLinUAE', 'IPL2020playoffs', 'UnacademyAskTheExperts', 'AltrozSuperStriker', 'Cricket', 'DelhiCapitals', 'YehHaiNayiDilli']",match tuesday november pm indian time xexcxa,8
433,11/9/2020 2:25,NA,"b'You win some, you lose some. But in life, you should always #KeepRising! \xf0\x9f\xa7\xa1  #OrangeArmy #IPL2020 #Dream11IPL thank you orange army https://t.co/xiWn4dqbjp'",b'beingmajedkhan',"['KeepRising', 'OrangeArmy', 'IPL2020', 'Dream11IPL']",win lose life always thank orange army,17
434,11/9/2020 2:25,Hamirpur (H.P) ,"b""That's it from this season, #OrangeArmy!   #DCvSRH #KeepRising #IPL2020 #OrangeArmy""",b'Urmy1625',"['OrangeArmy', 'DCvSRH', 'KeepRising', 'IPL2020', 'OrangeArmy']",thats season,5
435,11/9/2020 2:25,India,b'@thegadgetshub I will go with Pav Bhaji VS Chole Chawal  #IPL2020 #IPLfinal #MIvsDC',b'ProgrammingNat',"['IPL2020', 'IPLfinal', 'MIvsDC']",go pav bhaji v chole chawal,9
436,11/9/2020 2:25,NA,"b'You win some, you lose some. But in life, you should always #KeepRising! \xf0\x9f\xa7\xa1  #OrangeArmy #IPL2020 #Dream11IPL https://t.co/OQNQt05MVp'",b'MoggaAnilkumar',"['KeepRising', 'OrangeArmy', 'IPL2020', 'Dream11IPL']",win lose life always,13
437,11/9/2020 2:24,"Kanpur, India",b'DC FANS FROM NOWHERE \xf0\x9f\x98\x82\xf0\x9f\x98\x82\xf0\x9f\x98\x82 #IPL2020',b'ahmed_razim',['IPL2020'],dc fan nowhere xfxfxxxfxfxxxfxfxx,5
438,11/9/2020 2:24,World Wide Web,b'@VIP_Innerwear @imPalak18 MI ..will win  #ContestAlert #IPL2020 #IPLmatch #IPLDUBAI #CricketLive #CricketDhamaka @VIP_Innerwear  Tag  @SandipB38346287          @banashree007  @BarbieGirl009         @AmbaMonika  @AmitVerMa77928',b'Vikas39372762',"['ContestAlert', 'IPL2020', 'IPLmatch', 'IPLDUBAI', 'CricketLive', 'CricketDhamaka']",mi win tag,4
439,11/9/2020 2:24,NA,"b'You win some, you lose some. But in life, you should always #KeepRising! \xf0\x9f\xa7\xa1  #OrangeArmy #IPL2020 #Dream11IPL #OrangeArmy https://t.co/dkHpPtennS'",b'Urmy1625',"['KeepRising', 'OrangeArmy', 'IPL2020', 'Dream11IPL', 'OrangeArmy']",win lose life always,13
440,11/9/2020 2:24,punjab india,b'DADA we love you.. @SGanguly99 #IPL2020 #SRHvDC #DCvSRH  @BCCI @cricbuzz https://t.co/DkNs4X9PFj',b'prasu0707',"['IPL2020', 'SRHvDC', 'DCvSRH']",dada love,4
441,11/9/2020 2:23,Mumbai,"b'Well played @DelhiCapitals , through the final #DCvsSRH #DelhiCapitals #IPL2020 @IPL #Dream11IPL'",b'SagarPateliya7',"['DCvsSRH', 'DelhiCapitals', 'IPL2020', 'Dream11IPL']",well played,5
442,11/9/2020 2:23,Round Earth,b'Good play TO @SunRisers  in  IPL2020  #IPL2020 #KeepRising #DCvSRH #DCvsMI #Dream11IPLSRHvRCB #Dream11IPLMIvDC #Dream11Team #DelhiCapitals #IPL #IPL https://t.co/hYwWqHD5ai',b'MoggaAnilkumar',"['IPL2020', 'KeepRising', 'DCvSRH', 'DCvsMI', 'Dream11IPLSRHvRCB', 'Dream11IPLMIvDC', 'Dream11Team', 'DelhiCapitals', 'IPL', 'IPL']",good play,5
443,11/9/2020 2:23,India,"b'#IPL2020 |  \xe2\x80\x98Playing his first IPL, Padikkal\xe2\x80\x99s impact has been bigger than Bumrah and Pandya\xe2\x80\x99   reports @aditya_bh16  https://t.co/H8FsQT8ZLu'",b'HTSportsNews',['IPL2020'],xexxplaying first padikkalxexxs impact bigger bumrah pandyaxexx report,14
444,11/9/2020 2:23,"New Delhi, India","b""Predictors can put their prediction's up their asses. #IPL2020  #OrangeArmy""",b'RamyaKolluru10',"['IPL2020', 'OrangeArmy']",predictor put prediction ass,8
445,11/9/2020 2:21,"New Delhi, India",b'@KP24 Available for next IPL season? Looks like you are inspired by MSD \xf0\x9f\x98\x80 #IPL2020 @IPL should keep eye on this legend...',b'immrtejas',['IPL2020'],available next season look like inspired msd keep eye legend,19
446,11/9/2020 2:20,NA,"b'Long time fan, second time participant, first time winner. Thank you @joybhattacharj for these questions; these questions are the best part of IPL, maybe second best, right after @mipaltan winning! ;) #IPL2020 #Qualifier2 #SRHvsDC https://t.co/lhveTpbo6x'",b'Pratik06Jedhe',"['IPL2020', 'Qualifier2', 'SRHvsDC']",long time fan second time participant first time winner thank question question best part maybe second best right winning,28
447,11/9/2020 2:20,"Sharjah, UAE / Pune, India",b'Delhi Vs Mumbai.   Clash of the heavyweights in the #IPL2020 finals. Rishabh Pant &amp; Rohit Sharma.   #DCvsMI',b'The_Kafir_boy',"['IPL2020', 'DCvsMI']",delhi v mumbai clash heavyweight final rishabh pant rohit sharma,15
448,11/9/2020 2:19,"Sydney, New South Wales","b""One Many Army #KaneWilliamson \xe2\x9d\xa4\xef\xb8\x8f #SRH Win People's Heart's !  Congrats &amp; Best Wishes #DelhiCapitals U deserve it \xf0\x9f\x98\x8a  Final Meet #MumbaiIndians  #SRHvDC #DCvsSRH #Warner #YehHaiNayiDilli #Dream11IPL #IPL2020 #ShreyasIyer #OrangeArmy https://t.co/XkfSPgjuKc""",b'SathyaPriya_Off',"['KaneWilliamson', 'SRH', 'DelhiCapitals', 'MumbaiIndians', 'SRHvDC', 'DCvsSRH', 'Warner', 'YehHaiNayiDilli', 'Dream11IPL', 'IPL2020', 'ShreyasIyer', 'OrangeArmy']",one many army xexdxaxefxbxf win people heart congrats best wish deserve meet,17
449,11/9/2020 2:18,"Saket, New Delhi","b'@vikramchandra A night when one of your contemporaries is being pushed and shoved in a jail with hardened criminals, all you cld think is abt who will win #IPL2020 .'",b'AngryyAnna',['IPL2020'],night one contemporary pushed shoved jail hardened criminal cld think abt win,27
450,11/9/2020 2:15,"New Delhi, India",b'Highest Number of Ducks in IPL History.  #IPL  #IPLfinal #sportzcraazy #cricket #Matchday #IPL #IPLT20 #SRH #DC #IPL2020 #DCvMI #MIVDC   https://t.co/vWdjCkNVbl',b'sportzcraazy',"['IPL', 'IPLfinal', 'sportzcraazy', 'cricket', 'Matchday', 'IPL', 'IPLT20', 'SRH', 'DC', 'IPL2020', 'DCvMI', 'MIVDC']",highest number duck history,7
451,11/9/2020 2:15,India,b'How did a team that won seven of its first ten games disintegrate so spectacularly? #IPL2020',b'ESPNcricinfo',['IPL2020'],team seven first ten game disintegrate spectacularly,15
452,11/9/2020 2:14,Mumbai,b'No. of IPL finals for each team:  8 - CSK 6 - MI 3 - RCB 2 - KKR 2 - SRH 1 - Deccan 1 - KXIP 1 - RR 1 - RPS 1 - Delhi   #IPL2020 #MIvDC #IPLFinal',b'The_Kafir_boy',"['IPL2020', 'MIvDC', 'IPLFinal']",final team csk mi rcb kkr srh deccan kxip rr rps delhi,17
453,11/9/2020 2:13,NA,"b""The way knocking out of  teams from playoffs  has  been so far sequentially,,, seems #MumbaiIndians Will lift the trophy, but i want a new champ.#DelhiCapitals &amp; i'm not MI fan &amp; cricket is a game of uncertainties.. Come on Delhi #IPL2020 #IPLfinal #DCvSRH #MarcusStoinis https://t.co/ADHMYYlqHE""",b'pradeep_paro',"['MumbaiIndians', 'DelhiCapitals', 'IPL2020', 'IPLfinal', 'DCvSRH', 'MarcusStoinis']",way knocking team playoff far sequentially seems lift trophy want new champ im mi fan cricket game uncertainty come delhi,39
454,11/9/2020 2:13,India,b'Congratulations #DelhiCapitals on reaching the finals. The only active IPL team to have not ever played a final makes it to the final. 2020... Aur bahut kuch dikhayega. #DCvSRH #IPL2020',b'The_Kafir_boy',"['DelhiCapitals', 'DCvSRH', 'IPL2020']",congratulation reaching final active team ever played make aur bahut kuch dikhayega,26
455,11/9/2020 2:12,India,b'#IPL2020  1. #MI  2.#DC  3.#SRH 2nd to get knocked out in playoffs  4.#rcb  1st to get knocked out in playoffs!! Who would be next??',b'sk_kodaikel',"['IPL2020', 'MI', 'DC', 'SRH', 'rcb']",nd get knocked playoff st get knocked playoff would next,18
456,11/9/2020 2:12,NA,"b'Gautam Gambhir :- ""World Cup was won by entire Indian team not just by MS Dhoni""  Gautam Gambhir :- ""Virat Kohli should be blamed for RCB\'s loss""  #GautamGambhir #Viratkohli #IPL2020'",b'DeadlyYorkers',"['GautamGambhir', 'Viratkohli', 'IPL2020']",gautam gambhir world cup entire indian team m dhoni gautam gambhir virat kohli blamed rcbs loss,25
457,11/9/2020 2:11,"नई दिल्ली, भारत","b""Kkr got eliminated the day after SRK's birthday RCB got eliminated the day after Virat's birthday Tomorrow is final and it's Prithvi's birthday today You know what i mean\xf0\x9f\x98\x82 #IPL2020 #DCvsMI""",b'prashantpaude15',"['IPL2020', 'DCvsMI']",kkr got eliminated day srks birthday rcb got eliminated day virats birthday tomorrow prithvis birthday today know meanxfxfxx,29
458,11/9/2020 2:10,India,b'Rashid Khan gives sendoff to Marcus Stoinis #IPL2020  https://t.co/cCCV50W6Bf',b'india_fantasy',['IPL2020'],rashid khan give sendoff marcus stoinis,7
459,11/9/2020 2:09,UK | USA | Singapore,"b""#IPL2020 #DCvsSRH  Yuvraj Singh trolls Shikhar Dhawan for not reviewing dismissal vs SRH: 'How about DRS bro?'  READ: https://t.co/gu7O7989qS https://t.co/7lIco5o4NL""",b'timesnowsports',"['IPL2020', 'DCvsSRH']",yuvraj singh troll shikhar dhawan reviewing dismissal v srh drs bro read,16
460,11/9/2020 2:09,"New Delhi, India",b'@joy_ebike Delhi Capitals  #IPLContest2020 #IPL2020  #JoyEbike  @joy_ebike  Join  @Lovelythestar19 @Monikastar15  @sharma_7979  @MananHawk  @Lvly123Singh',b'Shivamthepower1',"['IPLContest2020', 'IPL2020', 'JoyEbike']",delhi capital join,3
461,11/9/2020 2:08,"Bengaluru, India","b""It's time to select your team of the tournament, here's mine! @IPL #IPL2020   1. S Dhawan - DC 2. KL Rahul - KXIP 3. S Yadav - MI 4. ABD* - RCB 5. I Kishan - MI 6. R Tewatia - RR 7. R Khan* - SRH 8. J Archer* - RR 9. K Rabada* - DC 10. Y Chahal - RCB 11. J Bumrah - MI""",b'TomMoodyCricket',['IPL2020'],time select team tournament here mine dhawan dc kl rahul kxip yadav mi abd rcb kishan mi tewatia rr khan srh archer rr k rabada dc chahal rcb bumrah mi,43
462,11/9/2020 2:08,"Colombo, Srl Lanka","b'SRH is a great example ,of making most of the limited resources that one has. Extremely consistent side , no big individual stars, they really shine togther as a unit #SRH #IPL2020'",b'jhasubir',"['SRH', 'IPL2020']",srh great example making limited resource one extremely consistent side big individual star really shine togther unit,29
463,11/9/2020 2:08,India,b'Finally @DelhiCapitals !!!! #IPL2020 #IPLfinal',b'nmnarora',"['IPL2020', 'IPLfinal']",finally,1
464,11/9/2020 2:08,NA,b'@IrfanPathan @SunRisers Samad (if correctly mentored &amp; not over groomed) can be a very good limited overs player for Team India. He has to put in the hard work both in batting/bowling. Hope current management focuses on making the player &amp; not demolishing his confidence #IPL2020 #abdulsamad #SRH',b'jayntank',"['IPL2020', 'abdulsamad', 'SRH']",samad correctly mentored groomed good limited over player team india put hard work battingbowling hope current management focus making player demolishing confidence,43
465,11/9/2020 2:08,NA,"b'So, it is @RickyPonting-coached @DelhiCapitals vs #RickyPonting-earlier coached @mipaltan in #IPL2020 final. Anyone previously from DC now with MI? #sunrisers #MI #MIvsDC #MIvDC #DCvMI #DCvsMI'",b'gikkukrishnan',"['RickyPonting', 'IPL2020', 'sunrisers', 'MI', 'MIvsDC', 'MIvDC', 'DCvMI', 'DCvsMI']",coached v earlier coached anyone previously dc mi,16
466,11/9/2020 2:07,"New Delhi, India",b'Finals   #MIVsDC   #DC \xf0\x9f\x8f\x86\xf0\x9f\x91\x8d  #IPL2020 https://t.co/NCJNuMcNbE',b'ursmanoj238',"['MIVsDC', 'DC', 'IPL2020']",final xfxfxfxxfxfxxd,2
467,11/9/2020 2:07,NA,"b""S.Nadeem has been picked for the game against 5 left-handed batsmen \xf0\x9f\xa4\x94can anyone help me what was the plan in Bailly's head? Your bowling against 5 left-handed batsmen with no off spinner in your bowling line up while Nabi is in the bench \xf0\x9f\xa4\x94. #SRHvsDC #IPL2020""",b'wais_qanit',"['SRHvsDC', 'IPL2020']",snadeem picked game lefthanded batsman xfxfxaxcan anyone help plan baillys head bowling lefthanded batsman spinner bowling line nabi bench xfxfxax,42
468,11/9/2020 2:07,India,b'Soo the top 2 teams on the pointstable will have the @ipl2020\xf0\x9f\x8f\x86final game in between them. Deserve &amp; axciting sides on the charts. Will be the cracker of the game at tuesday night. #IPL2020 #rawatrahul9 #AskSportsTak #vikrantgupta',b'VinitShende1',"['IPL2020', 'rawatrahul9', 'AskSportsTak', 'vikrantgupta']",soo top team pointstable xfxfxfxfinal game deserve axciting side chart cracker game tuesday night,32
469,11/9/2020 2:06,"Noida, India",b'How did you predict it...!? \xf0\x9f\x98\xb3  \xf0\x9f\x91\x8f\xf0\x9f\x91\x8f  #IPL2020 #IPLPrediction https://t.co/e49glBNdyT',b'VashiForever',"['IPL2020', 'IPLPrediction']",predict xfxfxxb xfxfxxfxfxfxxf,7
470,11/9/2020 2:06,somewhere in 8.8Φ1026 UNIVERSE,"b""The main thing is attitude in the field. You can't win if you don't take catches, we'll have to do much better next time - that's what's let us down in this tournament - the attitude on the field.\xc2\xa0 @davidwarner31 @IPL  #srh #DCvSRH #KaneWilliamson #IPL2020""",b'urstrulyGT',"['srh', 'DCvSRH', 'KaneWilliamson', 'IPL2020']",main thing attitude field cant win dont take catch well much better next time thats whats let u tournament attitude fieldxcxa,37
471,11/9/2020 2:05,NA,b'Whenever a team who  1. Did not lose 2 back to back matches  2. Won #Qualifier 1  3. Beat opponent 3 times before final  Won the #IPL  2018 - #CSK 2019 - #MI  #MumbaiIndians is the only team to achieve all mentioned records this year  #IPL2020 #IPLFinal #MIvDC #MIvsDC #Final #DC',b'Rushikeshbhang3',"['Qualifier', 'IPL', 'CSK', 'MI', 'MumbaiIndians', 'IPL2020', 'IPLFinal', 'MIvDC', 'MIvsDC', 'Final', 'DC']",whenever team lose back back match beat opponent time team achieve mentioned record year,30
472,11/9/2020 2:05,NA,b'Eagerly waiting for tomorrow match \xe2\x9d\xa4.All the best for both of team  #IPL2020 #IPL2020final https://t.co/EYzO137V7K',b'Yashaswisharm17',"['IPL2020', 'IPL2020final']",eagerly waiting tomorrow match xexdxaall best team,12
473,11/9/2020 2:04,India,"b'Photos: Shikhar Dhawan, Marcus Stoinis shine as DC book place in maiden IPL final #IPL2020 #CricketDhamaka #DCvsSRH   https://t.co/CZWlSDptx9'",b'IndiaTVSports',"['IPL2020', 'CricketDhamaka', 'DCvsSRH']",photo shikhar dhawan marcus stoinis shine dc book place maiden,14
474,11/9/2020 2:04,New Delhi,"b'Heads should be up for Sunrisers Hyderbad - Bhuvi injured, Vijay Shankar injured, Saha injured, Mitchell Marsh injured, Williamson missed few matches but still managed to finish 3rd in #IPL2020 - Well done, Warner Army. #SunrisersHyderabad  #IPL2020'",b'VikashBeny',"['IPL2020', 'SunrisersHyderabad', 'IPL2020']",head sunrisers hyderbad bhuvi injured vijay shankar injured saha injured mitchell marsh injured williamson missed match still managed finish rd well done warner army,32
475,11/9/2020 2:02,NA,"b""Can't Sleep last Night Till 3:30 pm. Lot's of Negative Thoughts are Comming in my Mind.\xf0\x9f\x98\xad  @ImRo45 We Believe You More than Any Others. Do well in Final. Won't To see the lost against Minnow Team.\xf0\x9f\x98\xad\xf0\x9f\x99\x8f  #IPL2020 #IPLfinal @mipaltan""",b'LoyalRohitFan_',"['IPL2020', 'IPLfinal']",cant sleep last night till pm lot negative thought comming mindxfxfxxad believe others well wont see lost minnow teamxfxfxxadxfxfxxf,34
476,11/9/2020 2:02,"New Delhi, India",b'@SunRisers @jbairstow21 i dont think that johhny gives his 100 percent in this #IPL2020',b'KhapardeSwapnil',['IPL2020'],dont think johhny give percent,10
477,11/9/2020 2:01,"Kolkata, India",b'#ipl2018 : #CSK won the title defeating #SRH for the fourth time in the season. #ipl2019 : #mi won the title defeating #CSK for the fourth time in the season #IPL2020 : #MIvsDC in the final. #mi already won 3 matches against capitals. \xf0\x9f\xa4\xb7\xe2\x80\x8d\xe2\x99\x82\xef\xb8\x8f',b'KIRANCHANDYEN',"['ipl2018', 'CSK', 'SRH', 'ipl2019', 'mi', 'CSK', 'IPL2020', 'MIvsDC', 'mi']",title defeating fourth time season title defeating fourth time season already match capital xfxfxaxbxexxdxexxxefxbxf,31
478,11/9/2020 2:00,"Ambala, India",b'#IPL2020 #Qualifier2 #DCvSRH Yuvraj Singh hilariously trolls Shikhar Dhawan for not reviewing LBW against SRH  https://t.co/jfReEODt54',b'IndiaTVSports',"['IPL2020', 'Qualifier2', 'DCvSRH']",yuvraj singh hilariously troll shikhar dhawan reviewing lbw srh,12
479,11/9/2020 2:00,"Chennai, India","b""So in this year's IPL final, Delhi is underdog against MI. And every one wants underdog to conquer the strongest team of MI. @DelhiCapitals  @ShreyasIyer15   #IPLfinal  #IPL2020""",b'parvez_velani',"['IPLfinal', 'IPL2020']",year delhi underdog mi every one want underdog conquer strongest team mi,23
480,11/9/2020 2:00,Bengaluru,"b'i watched #KalHoNaaHo yesterday, and then watching the #IPL2020  qualifier earlier today led me to an interesting analogy. bear with me on this thread-'",b'borotmon',"['KalHoNaaHo', 'IPL2020']",watched yesterday watching qualifier earlier today led interesting analogy bear thread,22
481,11/9/2020 2:00,"नई दिल्ली, भारत",b'Win ayyi Unte Bagunnu #SRH  But You Win Our Hearts \xf0\x9f\x92\x9d  Better Luck Next Tym @SunRisers \xf0\x9f\xa4\x97  #DC Well Played Hope Finals Lo Kuda  Edhe Josh Continue Cheyandi \xf0\x9f\xa4\xa8  #SRHvDC #IPL2020 https://t.co/bluRCXpYsi',b'IMPravallikaM17',"['SRH', 'DC', 'SRHvDC', 'IPL2020']",win ayyi unte bagunnu win heart better luck next tym xfxfxax well played hope final lo kuda edhe josh continue cheyandi,26
482,11/9/2020 2:00,NA,b'@DelhiCapitals I Really Wanted From My Heart.. You Should Bring Trophy At Home.. Because Your Team Deserve It.. Best Wishes for Final.. #Dream11IPL  #IPL2020  #final  #YehHaiNayiDilli  #DelhiCapitals https://t.co/PN25bgsa6R',b'mr_chirg_',"['Dream11IPL', 'IPL2020', 'final', 'YehHaiNayiDilli', 'DelhiCapitals']",really wanted heart bring trophy home team deserve best wish,21
483,11/9/2020 2:00,"New Delhi, India",b'Haha @DelhiCapitals won this ipl trophy \xf0\x9f\x8f\x86 #ipl2020 @SDhawan25 @RishabhPant17 @ShreyasIyer15 @mipaltan \xe2\x9c\x8d\xef\xb8\x8f\xe2\x9c\x8d\xef\xb8\x8f\xe2\x9c\x8d\xef\xb8\x8f\xe2\x9c\x8d\xef\xb8\x8f\xe2\x9c\x8d\xef\xb8\x8f #DelhiCapitals #MumbaiIndians',b'GeevanjiVarun',"['ipl2020', 'DelhiCapitals', 'MumbaiIndians']",haha trophy xfxfxfx xexcxdxefxbxfxexcxdxefxbxfxexcxdxefxbxfxexcxdxefxbxfxexcxdxefxbxf,7
484,11/9/2020 2:00,"Chennai, India","b'#IPL2020 | With this win, @DelhiCapitals has entered IPL final for the first time  #DelhiCapitals   https://t.co/i3gDhnn9Hg'",b'JagranEnglish',"['IPL2020', 'DelhiCapitals']",win entered first time,11
485,11/9/2020 1:59,"Chennai, India",b'#Monk #KaneWilliamson  Just simply awesome  #IPL2020  #srh well played...  All the best for #DelhiCapitals',b'venkateshaperu3',"['Monk', 'KaneWilliamson', 'IPL2020', 'srh', 'DelhiCapitals']",simply awesome well played best,9
486,11/9/2020 1:59,"Chennai, India",b'Now we want a new champion.  #IPL2020 #IPLfinal #IPLPlayoffs #MIvsDC',b'msdian_deepak7',"['IPL2020', 'IPLfinal', 'IPLPlayoffs', 'MIvsDC']",want new champion,6
487,11/9/2020 1:59,"Chennai, India",b'No. of IPL finals for each team:  8 - CSK 6 - MI 3 - RCB 2 - KKR 2 - SRH 1 - Deccan 1 - KXIP 1 - RR 1 - RPS 1 - Delhi   #IPL2020 #MIvDC #IPLFinal',b'gurunathaa4',"['IPL2020', 'MIvDC', 'IPLFinal']",final team csk mi rcb kkr srh deccan kxip rr rps delhi,17
488,11/9/2020 1:57,INDIA,b'Congratulations on an excellent campaign @sunrisers. You took your supporters on a roller coaster but you produced a lot of joy Srhvsdc #ipl2020',b'ImAkumar07',['ipl2020'],congratulation excellent campaign took supporter roller coaster produced lot joy srhvsdc,21
489,11/9/2020 1:57,Anbe Sivam,b'I Learn What Is Never Give Up &amp; Fight Back Spirit From #OrangeArmy  #kane Still Fighting At the end.. We Just Love It.. So Proud To Be fan of #SRH  We will soon #2021  #Dream11IPL  #DCvsSRH  #IPL2020  #Qualifier2  #nevergiveup https://t.co/h0RxgeC5RD',b'mr_chirg_',"['OrangeArmy', 'kane', 'SRH', 'Dream11IPL', 'DCvsSRH', 'IPL2020', 'Qualifier2', 'nevergiveup']",learn never give fight back spirit still fighting end love proud fan soon,30
490,11/9/2020 1:56,NA,"b""#IPL2020 | \xe2\x80\x9cYou can't win if you don't take catches, we'll have to do much better next time - that's what's let us down in this tournament - the attitude on the field,\xe2\x80\x9d said #SRH skipper #DavidWarner on losing to #DC on 8 November.  https://t.co/mcLSvLuRJ4""",b'TheQuint',"['IPL2020', 'SRH', 'DavidWarner', 'DC']",xexxcyou cant win dont take catch well much better next time thats whats let u tournament attitude fieldxexxd said skipper losing november,36
491,11/9/2020 1:56,"New Delhi, India","b""Who will win #IPL2020 title cup  Let's take one moment   #OneFamily #MumbaiIndians #DelhiCapitals #sunrisers #WhistlePodu #RoyalsFamily #RoyalChallengersBangalore #kkrhaitaiyaar #KXIP #SarkaruVaariPaata""",b'prince19M7',"['IPL2020', 'OneFamily', 'MumbaiIndians', 'DelhiCapitals', 'sunrisers', 'WhistlePodu', 'RoyalsFamily', 'RoyalChallengersBangalore', 'kkrhaitaiyaar', 'KXIP', 'SarkaruVaariPaata']",win title cup let take one moment,9
492,11/9/2020 1:55,"New Delhi, India",b'@DelhiCapitals made it to the finals with a great victory by 17 runs against SunRisers Hyderabad. Congratulation Delhi Capitals! DC will play against @mipaltan in finals on the 10th of November (tomorrow). Who do you think will take the #IPL2020 trophy? #DCvsMI',b'karthikyadav_07',"['IPL2020', 'DCvsMI']",made final great victory run sunrisers hyderabad congratulation delhi capital dc play final november tomorrow think take trophy,37
493,11/9/2020 1:55,India,b'The things that we love tell us what we are #GoodMorningTwitterWorld #IPL2020 #kamarajupeta #AndhraPradesh #WINTER #winterbeauty #MondayMotivation https://t.co/3Jg7qCvSHS',b'Maahi3389',"['GoodMorningTwitterWorld', 'IPL2020', 'kamarajupeta', 'AndhraPradesh', 'WINTER', 'winterbeauty', 'MondayMotivation']",thing love tell u,10
494,11/9/2020 1:54,NA,b'Please vote  #MumbaiIndians #MI #DelhiCapitals #YehHaiNayiDilli  #MIvsDC #IPL2020 #IPLfinal #IPLPlayoffs https://t.co/IxKKDoKGdE',b'dhonidipu1612',"['MumbaiIndians', 'MI', 'DelhiCapitals', 'YehHaiNayiDilli', 'MIvsDC', 'IPL2020', 'IPLfinal', 'IPLPlayoffs']",please vote,2
495,11/9/2020 1:54,With @Rajasthanroyals ,b'#IPL2020 | Here are the top 4 cricketers who performed incredibly well during the match of #DelhiCapitals and #SRH.  https://t.co/e0WuUx6kI5',b'TheQuint',"['IPL2020', 'DelhiCapitals', 'SRH']",top cricketer performed incredibly well match,14
496,11/9/2020 1:53,RT on #RanjiKerala -  🏏,b'WHO WILL WIN THE IPL 2020?  #MumbaiIndians #MI #OneFamily  #YehHaiNayiDilli #DelhiCapitals #IPL2020  #IPLfinal #IPLPlayoffs  @mipaltan \xf0\x9f\x86\x9a @DelhiCapitals',b'msdian_deepak7',"['MumbaiIndians', 'MI', 'OneFamily', 'YehHaiNayiDilli', 'DelhiCapitals', 'IPL2020', 'IPLfinal', 'IPLPlayoffs']",win,6
497,11/9/2020 1:52,"Tondiarpet, VadaChennai",b'Before the starting of the #IPL2020 I had said #DelhiCapitals is the favourite to win this #IPL2020 .... Now they are in finals for the first time... We all want #DelhiCapitals to win this time... #DelhiCapitals  #IPL2020  #IPLfinal',b'Vivekk057',"['IPL2020', 'DelhiCapitals', 'IPL2020', 'DelhiCapitals', 'DelhiCapitals', 'IPL2020', 'IPLfinal']",starting said favourite win final first time want win time,30
498,11/9/2020 1:52,"Tondiarpet, VadaChennai",b'#IPL2020 | Netizens congratulated #DC for reaching their first final and applauded the team\xe2\x80\x99s performance against #SRH.  https://t.co/d47tpyrXIR',b'TheQuint',"['IPL2020', 'DC', 'SRH']",netizens congratulated reaching first applauded teamxexxs performance,13
499,11/9/2020 1:52,"Tondiarpet, VadaChennai",b'Delhi Capital at final! 1st time ever!  #SRHvDC #IPL2020',b'MDTHasanNaim55',"['SRHvDC', 'IPL2020']",delhi capital st time ever,7
500,11/9/2020 1:51,Agra ,b'Are you all ready for the #finals of #IPL2020 . #DelhiCapitals #MumbaiIndians @DelhiCapitals @mipaltan',b'Vanshthakur01',"['finals', 'IPL2020', 'DelhiCapitals', 'MumbaiIndians']",ready,7
501,11/9/2020 1:51,"Mumbai, India",b'@DelhiCapitals enter @IPL final. Clash tomorrow vs @mipaltan  good play and Fight @SunRisers nice memory in #ipl #IPL2020 #DCvSRH',b'itsmejohnson93',"['ipl', 'IPL2020', 'DCvSRH']",enter clash tomorrow v good play fight nice memory,12
502,11/9/2020 1:48,NA,"b'Heads should be up for Sunrisers Hyderbad - Bhuvi injured, Vijay Shankar injured, Saha injured, Mitchell Marsh injured, Williamson missed few matches but still managed to finish 3rd in #IPL2020 - Well done, Warner Army.'",b'VasanthJVK',['IPL2020'],head sunrisers hyderbad bhuvi injured vijay shankar injured saha injured mitchell marsh injured williamson missed match still managed finish rd well done warner army,32
503,11/9/2020 1:48,RT on #RanjiKerala -  🏏,"b""#IPL2020: You can't win tournaments if you keep dropping catches, says #DavidWarner  https://t.co/XpnXTvjPYb""",b'ZeeNewsEnglish',"['IPL2020', 'DavidWarner']",cant win tournament keep dropping catch say,10
504,11/9/2020 1:48,NA,b'Can we give the cup to Mumbai Indians Please..#MumbaiIndians #IPL2020 https://t.co/LUvV3IPZpd',b'karnsanjev',"['MumbaiIndians', 'IPL2020']",give cup mumbai indian please,9
