,created,user_location,tweet_text,username,all_hashtags,refine_text,text_length
711,11/8/2020 19:59,Mumbai (Maharashtra) India,"b'I was highly impressed by the way @Natarajan_91 bowled in this tournament , his Yorkers were on point . He has delivered more Yorkers than @Jaspritbumrah93 @KagisoRabada25 @JofraArcher @AnrichNortje02 .  What an amazing tournament he had .   #IPL2020 #OrangeArmy'",b'imsbhatt0707',"['IPL2020', 'OrangeArmy']",highly impressed way bowled tournament yorkers point delivered yorkers amazing tournament,28
712,11/8/2020 19:59,NA,"b'""If we play our best game in the final, it would be good enough for MI,"" said #DelhiCapitals\' ace all-rounder #MarcusStoinis, after an emphatic victory over #SRH in the Qualifier 2  #DCvSRH #ShreyasIyer #Rabada #KaneWilliamson #IPL2020 https://t.co/aZXRSuSVo0'",b'cricbuzz',"['DelhiCapitals', 'MarcusStoinis', 'SRH', 'DCvSRH', 'ShreyasIyer', 'Rabada', 'KaneWilliamson', 'IPL2020']",play best game would good enough mi said ace allrounder emphatic victory qualifier,27
713,11/8/2020 19:57,underground ,b'Well played @rashidkhan_19 \xf0\x9f\x91\x8f\xf0\x9f\x91\x8f\xf0\x9f\x91\x8f what a consistency with the ball throughout the tournament... Keep it up.  #IPL2020 #OrangeArmy  @SunRisers',b'chintu002',"['IPL2020', 'OrangeArmy']",well played xfxfxxfxfxfxxfxfxfxxf consistency ball throughout tournament keep,15
714,11/8/2020 19:57,"Gurgaon, India",b'Well played #delhicapital \xf0\x9f\x92\xaf  #IPL2020  #SRHvsDC',b'emsuman',"['delhicapital', 'IPL2020', 'SRHvsDC']",well played xfxfxxaf,3
715,11/8/2020 19:56,"Bengaluru South, India",b'A good coach will make his players see what they can be rather than what they are. @RickyPonting \xf0\x9f\x99\x8c @MohammadKaif @DelhiCapitals #DCvSRH #IPL2020 #DelhiCapitals #YehHaiNayiDilli https://t.co/VpALe5PnbV',b'Dark_knight_717',"['DCvSRH', 'IPL2020', 'DelhiCapitals', 'YehHaiNayiDilli']",good coach make player see rather xfxfxxc,18
716,11/8/2020 19:56,"Kolkata, India",b'MI vs DC #IPL2020 10 November final',b'AnasKha30539565',['IPL2020'],mi v dc november,5
717,11/8/2020 19:56,NA,b'The financial capital of India will be facing the National capital of India on Nov 10th.  Waiting to watch whether it will be head or heart....#IPL2020',b'manoharsai100',['IPL2020'],financial capital india facing national capital india nov waiting watch whether head heart,26
718,11/8/2020 19:56,NA,"b'Mumbai Indians and Delhi Capitals - two teams with massive backroom staff make it to the #IPL2020 final. Fancy a 10-over game between the likes of Ponting, Kaif, Dahiya, Harris &amp; Jayawardene, Robin, Bond? What if Sachin, Zak also turn up? MI favourites here too? #MIvDC #DCvsMI'",b'Ateet_Sharma',"['IPL2020', 'MIvDC', 'DCvsMI']",mumbai indian delhi capital two team massive backroom staff make fancy game like ponting kaif dahiya harris jayawardene robin bond sachin zak also turn mi favourite,43
719,11/8/2020 19:55,Mumbai,b'Who will win #IPL2020 ?  #MIvDC #DCvMI #IPLPrediction  #MIvsDC #DCvsMI #IPLfinal',b'jhadhruv206',"['IPL2020', 'MIvDC', 'DCvMI', 'IPLPrediction', 'MIvsDC', 'DCvsMI', 'IPLfinal']",win,3
720,11/8/2020 19:55,"Mumbai, India",b'Wow once again MIvsDC in IPL final #IPL2020 #MIvsDC hope MI will will this again...\xf0\x9f\x98\x83\xf0\x9f\x98\x83',b'NirajJa72785174',"['IPL2020', 'MIvsDC']",wow mivsdc hope mi againxfxfxxxfxfxx,13
721,11/8/2020 19:55,"Chennai, India","b""It's MI vs DC final #IPL2020""",b'KalraTarpan',['IPL2020'],mi v dc,5
722,11/8/2020 19:55,Canada ,b'Match day #Trailblazers  #woment20challenge #JioWomensT20Challenge #IPL2020  #SmritiMandhana #harleenDeol #harmanpreet #sm18 https://t.co/eKiHy7TOYy',b'ImGopiRaina',"['Trailblazers', 'woment20challenge', 'JioWomensT20Challenge', 'IPL2020', 'SmritiMandhana', 'harleenDeol', 'harmanpreet', 'sm18']",match day,2
723,11/8/2020 19:55,"West Bengal, India",b'Finally my Delhi \xf0\x9f\x98\x8d\xe2\x9d\xa4\xef\xb8\x8f @DelhiCapitals @ShreyasIyer15 \xe2\x9d\xa4\xef\xb8\x8f #IPL2020 #Dream11IPL #SRHvsDC #DelhiCapitals',b'Ishqqq2',"['IPL2020', 'Dream11IPL', 'SRHvsDC', 'DelhiCapitals']",finally delhi xfxfxxdxexdxaxefxbxf xexdxaxefxbxf,5
724,11/8/2020 19:54,"Melbourne, Victoria",b'\xe0\xa4\x93\xe0\xa4\xae \xe0\xa4\x9c\xe0\xa4\xaf \xe0\xa4\x9c\xe0\xa4\x97\xe0\xa4\xa6\xe0\xa5\x80\xe0\xa4\xb6 \xe0\xa4\x86\xe0\xa4\xad\xe0\xa4\xbe\xe0\xa4\xb0 \xe0\xa4\x85\xe0\xa4\xad\xe0\xa4\xbf\xe0\xa4\xa8\xe0\xa4\x82\xe0\xa4\xa6\xe0\xa4\xa8 THaNKs A ToN DeaR TeaM @igiworldwide  HaPpiNeSs DeLiVeReD #DiAMoND  #IGIBiLLiONSMiLeS  #IPL2020  #IGIWoRLDWiDe  #FeELiNG_BLeSsED  #ReGaRDs  @blessedkamal  #KaMaL_ADvANi  THaNKs A BuNCH To ALL My RoCKinG BuDdiEz FoR UnCoNDiTiOnaL SuPpORT AnD InSpiRaTiON https://t.co/xxQ60NLlHO',b'blessedkamal',"['DiAMoND', 'IGIBiLLiONSMiLeS', 'IPL2020', 'IGIWoRLDWiDe', 'FeELiNG_BLeSsED', 'ReGaRDs', 'KaMaL_ADvANi']",xexaxxexaxae xexaxcxexaxaf xexaxcxexaxxexaxaxexaxxexaxb xexaxxexaxadxexaxbexexaxb xexaxxexaxadxexaxbfxexaxaxexaxxexaxaxexaxa thanks ton dear team happiness delivered thanks bunch rocking buddiez unconditional support inspiration,25
725,11/8/2020 19:54,"Thane, India",b'congratulations #DelhiCapitals for an amazing win hope to see a great contest  in #IPL2020final #DCvsMI #IPL2020',b'monty1427',"['DelhiCapitals', 'IPL2020final', 'DCvsMI', 'IPL2020']",congratulation amazing win hope see great contest,12
726,11/8/2020 19:53,"Gandhinagar, India",b'It took 13 years and a name change for Delhi to get to their maiden IPL final. Huge credit goes to Shreyas Iyer for the way he has progressed as a captain and led this team #DC #IPL2020',b'Tusharjerry3',"['DC', 'IPL2020']",took year name change delhi get maiden huge credit go shreyas iyer way progressed captain led team,35
727,11/8/2020 19:53,India,b'So after 59games the 2best teams this season have made it to the #IPL2020 #finals #mi #DelhiCapitals #MIvsDC  #IPLfinal #Dubai Predictions??',b'ankdedhia',"['IPL2020', 'finals', 'mi', 'DelhiCapitals', 'MIvsDC', 'IPLfinal', 'Dubai']",game best team season made prediction,14
728,11/8/2020 19:52,"Junagad, India","b'Not sure about Stoinis making a key impact with the bat AND the bat ?? \xf0\x9f\x98\x90\xf0\x9f\x98\x95\xf0\x9f\xa4\xad  Anyway, a good win for #DC following a thumping from #MI, looking forward to the #IPL2020 #Final on Tuesday\xf0\x9f\x94\x9fth!! https://t.co/mgFCxyKl0p'",b'tauheeeeed07',"['DC', 'MI', 'IPL2020', 'Final']",sure stoinis making key impact bat bat xfxfxxxfxfxxxfxfxaxad anyway good win following thumping looking forward tuesdayxfxfxxfth,30
729,11/8/2020 19:52,India,b'WHAT A MATCH\xf0\x9f\x98\xb1!!!!!!  Delhi Capitals have won this thrilling Qualifier 2 beating SRH by 17 runs and have become the second  finalist of the IPL 2020 which is there first time in IPL history  Congratulations!!! DC TOLI \xf0\x9f\x92\x99 @DelhiCapitals   #IPL2020 #YehHaiNayiDilli #Crickbuster https://t.co/EuE4MDHP5d',b'CrickbusterC',"['IPL2020', 'YehHaiNayiDilli', 'Crickbuster']",matchxfxfxxb delhi capital thrilling qualifier beating srh run become second finalist first time history congratulation dc toli,35
730,11/8/2020 19:51,India,b'\xe2\x80\x98Bombay vs Dilli\xe2\x80\x99 has reached its ultimate boiling point #IPL2020 #DCvsMI',b'pallavpatodia',"['IPL2020', 'DCvsMI']",xexxbombay v dillixexx reached ultimate boiling point,9
731,11/8/2020 19:51,Bangalore,"b'Despite missing Amit Mishra and Ishant Sharma who could have solved the 3rd pacer/5th bowler problem, DC have done well to reach the Final.  #DC #IPL2020'",b'Nicket_S',"['DC', 'IPL2020']",despite missing amit mishra ishant sharma could solved rd pacerth bowler problem dc done well reach,24
732,11/8/2020 19:51,"jalna, Maharashtra",b'Favorite \xf0\x9f\x93\xb8 of this season of @IPL \xf0\x9f\x98\x8d @imVkohli \xe2\x9d\xa4\xef\xb8\x8f @ABdeVilliers17 \xe2\x9d\xa4\xef\xb8\x8f @RCBTweets \xe2\x9d\xa4\xef\xb8\x8f  #WeAreChallengers #PlayBold #Dream11IPL #IPL2020 https://t.co/XcH6JMNUSw',b'ImVikramSingh18',"['WeAreChallengers', 'PlayBold', 'Dream11IPL', 'IPL2020']",favorite xfxfxxb season xexdxaxefxbxf xexdxaxefxbxf xexdxaxefxbxf,10
733,11/8/2020 19:51,NA,"b'Thank you #OrangeArmy for this journey... #abdulsamad and #natarajan wow...   With the injured player we reached in playoff, made me your fan again and again.. Will love you till the last breath of my life.......  Thank you #SRH #SRHvsDC #IPL2020 #DelhiCapitals #Cricket'",b'KaprawanKneha',"['OrangeArmy', 'abdulsamad', 'natarajan', 'SRH', 'SRHvsDC', 'IPL2020', 'DelhiCapitals', 'Cricket']",thank journey wow injured player reached playoff made fan love till last breath life thank,34
734,11/8/2020 19:50,"New York, NY",b'Who\xe2\x80\x99s gonna win the finals  It\xe2\x80\x99s Dadi vs Delhi  \xf0\x9f\x94\x81for dadi  \xe2\x9d\xa4\xef\xb8\x8f for DC  #DCvSRH #IPL2020\xc2\xa0  #DelhiCapitals\xc2\xa0  #MumbaiIndians https://t.co/mjBXQL5GiY',b'Moneyyy_ish',"['DCvSRH', 'IPL2020', 'DelhiCapitals', 'MumbaiIndians']",whoxexxs gonna win final itxexxs dadi v delhi xfxfxxfor dadi xexdxaxefxbxf dc,16
735,11/8/2020 19:50,NA,"b'As I said earlier, it was the bad performance of #SRH in the Field which cost them.   Happy to discuss all these points in our post match analysis with our panel members \xf0\x9f\x98\x8d  #CricketPranthans  #DCvSRH #SRHvDC   #IPL #IPL2020 #Dream11IPL https://t.co/6nyxQXe7CZ'",b'ArjunVcOnline',"['SRH', 'CricketPranthans', 'DCvSRH', 'SRHvDC', 'IPL', 'IPL2020', 'Dream11IPL']",said earlier bad performance field cost happy discus point post match analysis panel member,32
736,11/8/2020 19:50,From Allah To Allah,b'#IPL2020 in #UAE  How #Delhi Capitals revived their title hopes   https://t.co/qkGWORCLm4',b'gulf_news',"['IPL2020', 'UAE', 'Delhi']",capital revived title hope,7
737,11/8/2020 19:50,Pune,"b'Real fun is losing the last 4 group stage matches, somehow getting qualified and raising our hopes, and then going out in style.  #IPL2020 #RCB https://t.co/rso3RGiPVl'",b'arnav_shyam',"['IPL2020', 'RCB']",real fun losing last group stage match somehow getting qualified raising hope going style,22
738,11/8/2020 19:50,Somewhere next to you,"b""Its good to see @DelhiCapitals rolls to final of #IPL2020, but team's fans made me upset..  #DelhiCapitals #YehHaiNayiDilli #MumbaiIndians #DelhiAirQuality #DelhiPollution https://t.co/CGTVClOkR8""",b'piyushjha1998',"['IPL2020', 'DelhiCapitals', 'YehHaiNayiDilli', 'MumbaiIndians', 'DelhiAirQuality', 'DelhiPollution']",good see roll team fan made upset,14
739,11/8/2020 19:50,NA,b'#IPL2020 final #MJvsRP \xf0\x9f\x92\xa5\xf0\x9f\x92\xa5\xf0\x9f\x92\xa5  it is the Time for to take revenge back !!!! @MahelaJay  #MI #SriLanka #Ipl https://t.co/LQtuy6N0b3',b'shamsharings',"['IPL2020', 'MJvsRP', 'MI', 'SriLanka', 'Ipl']",xfxfxxaxfxfxxaxfxfxxa time take revenge back,11
740,11/8/2020 19:49,NA,"b'The amount of injuries @SunRisers have to go through, still they made it to the playoffs that\xe2\x80\x99s remarkable .   Kane Williamson almost took his team through the Finals but appreciate the fact that @SunRisers didn\xe2\x80\x99t go down without a fight \xf0\x9f\x91\x8f\xf0\x9f\x91\x8f\xf0\x9f\x91\x8f\xf0\x9f\x91\x8f .  #IPL2020 #OrangeArmy'",b'imsbhatt0707',"['IPL2020', 'OrangeArmy']",amount injury go still made playoff thatxexxs remarkable kane williamson almost took team final appreciate fact didnxexxt go without fight xfxfxxfxfxfxxfxfxfxxfxfxfxxf,38
741,11/8/2020 19:48,Sri Lanka,"b""Mumbai will be tough to beat, I mean u look at the team and ur like damn that's a serious team. It will be like beating the australian team of 2000's, tough to beat but can be beaten and were beaten.   Backing my boys #DelhiCapitals to win the final   #IPL2020 #MIVDC""",b'Varunatorr',"['DelhiCapitals', 'IPL2020', 'MIVDC']",mumbai tough beat mean look team ur like damn thats serious team like beating australian team tough beat beaten beaten backing boy win,48
742,11/8/2020 19:47,India Qatar,"b'So, Mumbai Indians vs Delhi Capitals it is!  Lets gooooo..... #IPL2020 #IPLfinal  #MIvsDC'",b'PollyGoodFellow',"['IPL2020', 'IPLfinal', 'MIvsDC']",mumbai indian v delhi capital let gooooo,10
743,11/8/2020 19:47,NA,b'Its took  #DelhiCapitals 13 years to Reach 1 Final.. And there is a Team #RCB which has reached 6 playoffs and 3 Finals and still gets trolled for not winning a Trophy #IPL2020',b'Shahid__Tweets',"['DelhiCapitals', 'RCB', 'IPL2020']",took year reach team reached playoff final still get trolled winning trophy,26
744,11/8/2020 19:47,NA,"b'@vikramsathaye @davidwarner31 @SunRisers Thats an insult. In the kingdom of #Risers never forget to bow in front of our  beloved #kingWilliamson .Since this is your first mistake, we have let you off with a caution\xf0\x9f\x98\x82\xf0\x9f\x98\x82\xf0\x9f\x98\x82 #IPL2020 https://t.co/vNVCjV2ePE'",b'punya101',"['Risers', 'kingWilliamson', 'IPL2020']",thats insult kingdom never forget bow front beloved since first mistake let cautionxfxfxxxfxfxxxfxfxx,30
745,11/8/2020 19:47,Guwahati ,b'Marsh injured Bhuvi injured Vijay Shankar injured Saha injured But still made to the playoffs. Proud of you guys @SunRisers  my last tweet on #IPL2020',b'Samratravikanti',['IPL2020'],marsh injured bhuvi injured vijay shankar injured saha injured still made playoff proud guy last tweet,23
746,11/8/2020 19:47,NA,b'Putting it on @DelhiCapitals to take it Tuesday. #IPL2020 @SHetmyer @MStoinis',b'kieron_n',['IPL2020'],putting take tuesday,7
747,11/8/2020 19:47,"Bhubaneshwar, India","b'#IPL2020 team of the season  KL (wk) Shikhar  SKY Pooran  Hardik  Tewatia Polly (C) Rashy  Joffffffra Shami  Boom  Kept to 4 OS and players in their actual roles  Having Shami in makes me feel a bit sick, but Indian seamers taking poles up top are non-existent'",b'nellbergcricket',['IPL2020'],team season kl wk shikhar sky pooran hardik tewatia polly c rashy joffffffra shami boom kept o player actual role shami make feel bit sick indian seamers taking pole top nonexistent,44
748,11/8/2020 19:47,NA,"b'Players like Abdul Samad can easily bat at no.6 or no.7 for Indian ODI as well as T20 teams and emulate the role of say Yusuf Pathan or Jadhav, the guy is super talented. Hopefully a good domestic season and there are hopes. #IPL2020'",b'udit_buch',['IPL2020'],player like abdul samad easily bat indian odi well team emulate role say yusuf pathan jadhav guy super talented hopefully good domestic season hope,43
749,11/8/2020 19:46,NA,b'DC vs MI...Hopefully the final would be an exciting one and not a one-sided affair like their previous encounters  #DelhiCapitals #MumbaiIndians  #IPL2020',b'bhijit13',"['DelhiCapitals', 'MumbaiIndians', 'IPL2020']",dc v mihopefully would exciting one onesided affair like previous encounter,19
750,11/8/2020 19:46,"मुंबई, भारत",b'Marcus Stoinis turned the tables for @DelhiCapitals as they brought on the curtains to a fighting run of play from @SunRisers ... #IPL2020 #SRHvDC #sunrisers #DelhiCapitals https://t.co/69dX1h8oZA',b'AbhiBSarda',"['IPL2020', 'SRHvDC', 'sunrisers', 'DelhiCapitals']",marcus stoinis turned table brought curtain fighting run play,19
751,11/8/2020 19:46,NA,b'@SunRisers Why @SunRisers ? You had one of the best squads this season! \xf0\x9f\x98\x94#IPL2020',b'oyeekd',['IPL2020'],one best squad season,11
752,11/8/2020 19:46,भारत,b'@SunRisers Why @SunRisers ? You had one of the best squads this season! \xf0\x9f\x98\x94#IPL2020',b'oyeekd',['IPL2020'],one best squad season,11
753,11/8/2020 19:45,India,b'DREAM 11 IPL FINAL MI vs DC @mipaltan @DelhiCapitals @IPL  #MumbaiIndians #DelhiCapitals #IPL2020  #MIvsDC Sponsored @Dream11 #Dream11 https://t.co/RmdUs5Vv0V',b'DevanPa53219230',"['MumbaiIndians', 'DelhiCapitals', 'IPL2020', 'MIvsDC', 'Dream11']",dream mi v dc sponsored,7
754,11/8/2020 19:45,"Chennai, India","b""#goindia #GoIndiaGame #googlepaygoindia #gpaygoindia #gpaytickets #GPay #IPL2020 #PSLVC49 #COVID19IndiaJoin  I'm looking for the Gaya ticket, do you have it with you? https://t.co/Ct078Yn7Wb""",b'lucky_Aj1437',"['goindia', 'GoIndiaGame', 'googlepaygoindia', 'gpaygoindia', 'gpaytickets', 'GPay', 'IPL2020', 'PSLVC49', 'COVID19IndiaJoin']",im looking gaya ticket,12
755,11/8/2020 19:45,"Nalgonda, India",b'Will the Delhi Capitals win their maiden IPL title? https://t.co/o7zuXx2JvP  #IPL2020 #IPLinUAE #IPL #DelhiCapitals #SunrisersHyderabad #sunrisers #Mumbai @gulf_news @ShyamKris_',b'GulfNewsSport',"['IPL2020', 'IPLinUAE', 'IPL', 'DelhiCapitals', 'SunrisersHyderabad', 'sunrisers', 'Mumbai']",delhi capital win maiden title,9
756,11/8/2020 19:45,NA,b'\xe2\x9a\xa1 #DELHICAPITALS REACH FIRST IPL FINAL \xe2\x9a\xa1  \xf0\x9f\x94\x98 Dhawan thumps superb 78 from 50 balls \xf0\x9f\x91\x8a \xf0\x9f\x94\x98 Stoinis makes key impact with bat &amp; bat \xf0\x9f\x8f\x8f \xf0\x9f\x94\x98 Williamson fifty in vain for #SRH \xf0\x9f\x94\x98 Rabada takes 4-29 including 3 in an over \xf0\x9f\x92\xa5  #DelhiCapitals to face #MumbaiIndians in #IPL2020 final.',b'SkyCricket',"['DELHICAPITALS', 'SRH', 'DelhiCapitals', 'MumbaiIndians', 'IPL2020']",xexaxa reach first xexaxa dhawan thump superb ball stoinis make key impact bat bat xfxfxfxf williamson fifty vain rabada take including face,41
757,11/8/2020 19:44,NA,b'Winner of #IPL2020 #Delhicapitals \xf0\x9f\x91\x8d\xf0\x9f\x91\x8d',b'Alikhan180118',"['IPL2020', 'Delhicapitals']",winner xfxfxxdxfxfxxd,3
758,11/8/2020 19:44,Meerut/NewDelhi/Akkistaan,"b""A solid opening stand and a bunch of dropped catches. Today's IPL game summary #IPL2020 #DCvSRH https://t.co/DGvIYdRInV""",b'ajaykaul10',"['IPL2020', 'DCvSRH']",solid opening stand bunch dropped catch today game summary,14
759,11/8/2020 19:43,Warangal,b'Who will win this #iplfinal match\xf0\x9f\x8f\x8f? #IPL2020 #MIvsDC  #IPLfinal  #Dubai  #2020RISE  #iplseason13 #Cricket  #CricketDhamaka  #cricketcountdown #Dream11IPLMIvDC  #winning  #competition',b'iam_ptmG',"['iplfinal', 'IPL2020', 'MIvsDC', 'IPLfinal', 'Dubai', '2020RISE', 'iplseason13', 'Cricket', 'CricketDhamaka', 'cricketcountdown', 'Dream11IPLMIvDC', 'winning', 'competition']",win matchxfxfxfxf,5
760,11/8/2020 19:43,"Mumbai, India","b'@jswsports are amazing team managers. Intervention clearly visible. First @bengalurufc, then @HaryanaSteelers, and now @DelhiCapitals. Producing title-challenging teams in every sports league they touch. Not even talking about countless Olympic athletes they support! #IPL2020'",b'Pranay_CK',['IPL2020'],amazing team manager intervention clearly visible first producing titlechallenging team every sport league touch even talking countless olympic athlete support,29
761,11/8/2020 19:43,Mumbai,b'MI vs. DC Final...MI are the overwhelming favourites but I would like DC to win. Good to have new champions. #IPL2020',b'Nicket_S',['IPL2020'],mi v dc finalmi overwhelming favourite would like dc win good new champion,20
762,11/8/2020 19:43,NA,"b'Each face here tells exact story of how they performed in that Play-off match. Dev: Little embarrassed with that shot Virat: Confused about how to play in knockouts AB: Stood up proudly for his team Siraj: ""I did pretty well, Saini\'s fault he couldn\'t defend 9 runs"" #IPL2020 https://t.co/tiTIqGaoTr'",b'fast_hostile',['IPL2020'],face tell exact story performed playoff match dev little embarrassed shot virat confused play knockout ab stood proudly team siraj pretty well sainis fault couldnt defend run,46
763,11/8/2020 19:42,"Kochi, Kerala, India ",b'My prediction is still Alive  #IPL2020 https://t.co/85WfJAtNru',b'Rjshwarpathak',['IPL2020'],prediction still alive,5
764,11/8/2020 19:42,India,"b'After each leap years #IPL  has new champion team,This time #DC ?  #IPL2020'",b'dsp842',"['IPL', 'DC', 'IPL2020']",leap year new champion teamthis time,9
765,11/8/2020 19:41,Mumbai,"b""That's very kind @DelhiCapitals. Go get your hands on the trophy \xf0\x9f\x92\x99. #SRHvsDC #IPL2020 #YehHaiNayiDilli https://t.co/0jny9CVohG""",b'notsoharshhh',"['SRHvsDC', 'IPL2020', 'YehHaiNayiDilli']",thats kind go get hand trophy,11
766,11/8/2020 19:41,"Vishakhapatnam, India","b""Given the number of injuries this season and the fact that nobody gave us a chance before the tournament began, I think it was a great effort to come this far. You've made us fans proud @SunRisers.  #OrangeArmy forever \xf0\x9f\xa7\xa1\xf0\x9f\x92\xaa #SRHvsDC  #SRH #IPL2020""",b'Sakethspeaks',"['OrangeArmy', 'SRHvsDC', 'SRH', 'IPL2020']",given number injury season fact nobody gave u chance tournament began think great effort come far youve made u fan proud forever xfxfxaxaxfxfxxaa,38
767,11/8/2020 19:41,"Maharashtra, India",b'Finally Babar ko Support mi gaya Haider + Babar Hope for Pakistan  Pakistan Opening problems  Changes for 3rd T20?  Why Mumbai Indian Best IPL team?  Who will win #IPL2020 Final?  Discussion with @CricSubhayan @leenacricket @jibransiddiqui  https://t.co/mW90eshlqf  #DCvSRH',b'GhaffarDawnNews',"['IPL2020', 'DCvSRH']",finally babar ko support mi gaya haider babar hope pakistan pakistan opening problem change rd mumbai indian best team win discussion,30
768,11/8/2020 19:40,NA,b'Life Lesson \xf0\x9f\x99\x8c Gem of a Man! \xe2\x99\xa5\xef\xb8\x8f #KaneWilliamson  #SRHvsDC #Srh #sunrisers #OrangeArmy #IPL2020 https://t.co/zzX5YrEmQt',b'vivek_dodda',"['KaneWilliamson', 'SRHvsDC', 'Srh', 'sunrisers', 'OrangeArmy', 'IPL2020']",life lesson xfxfxxc gem man xexxaxefxbxf,8
769,11/8/2020 19:40,India,"b'*10th Nov 2020* Sorry girlfriend,Sorry Studies. It is IPL2020 FINALS, and i wanna celebrate Mumbai Indians victory\xf0\x9f\x8e\x89 Apko kya laga match dekhna hai? #MumbaiIndians #DCvsMI #paltan #IPL2020'",b'Tabishhansarii',"['MumbaiIndians', 'DCvsMI', 'paltan', 'IPL2020']",nov sorry girlfriendsorry study final wanna celebrate mumbai indian victoryxfxfxex apko kya laga match dekhna hai,22
770,11/8/2020 19:40,NA,b'Delhi locking horns with Mumbai in the IPL finals will be a great contest ... Hope we will get to see a cracker of a game ... And finally we will head to Australia subsequently  #IPL2020',b'AshwinGour4',['IPL2020'],delhi locking horn mumbai final great contest hope get see cracker game finally head australia subsequently,33
771,11/8/2020 19:40,NA,b'Congratulations @DelhiCapitals on reaching d finals. Brilliant batting by gabbar @SDhawan25 nd #MarcusStoinis 2 set up d game 4 d bowlers. Orange army @SunRisers should b proud of d way they had played wit so many players getting injured throughout d tournament #DCvsMI #IPL2020',b'tiwarymanoj',"['MarcusStoinis', 'DCvsMI', 'IPL2020']",congratulation reaching final brilliant batting gabbar nd set game bowler orange army b proud way played wit many player getting injured throughout tournament,36
772,11/8/2020 19:40,"Mumbai, India",b'#IPL2020 #DCvsSRH  Delhi Capitals quell Sunrisers to march into their first IPL final and set up a date with 4-time champions Mumbai Indians.  https://t.co/gls4JmZqvM',b'IExpressSports',"['IPL2020', 'DCvsSRH']",delhi capital quell sunrisers march first set date time champion mumbai indian,21
773,11/8/2020 19:39,"Pune , Maharashtra",b'#MI is the winner of #IPL2020 https://t.co/mtT1uImvi4',b'Chandrasheker9',"['MI', 'IPL2020']",winner,4
774,11/8/2020 19:38,NA,"b""Okay its MI Vs DC  As always rooting for MI and hoping Rohit to shine. But it's okay if DC beat us. After all this is what I was hoping for if not MI it should be DC #IPL2020 #MI #DC #MIvsDC #IPL2020final""",b'cva_tweets',"['IPL2020', 'MI', 'DC', 'MIvsDC', 'IPL2020final']",okay mi v dc always rooting mi hoping rohit shine okay dc beat u hoping mi dc,38
775,11/8/2020 19:38,New Delhi,b'@PrithviShaw Happy birthday Bro\xf0\x9f\x98\x8d\xf0\x9f\x98\x8d..You failed many matches in this ipl but still you are my @Dream11 captain all the time.. Never loss hope on u bro..you are a true champion.. #HappyBirthdayprithvishaw #DelhiCapitals #IPL2020',b'Vicky72248754',"['HappyBirthdayprithvishaw', 'DelhiCapitals', 'IPL2020']",happy birthday broxfxfxxdxfxfxxdyou failed many match still captain time never loss hope broyou true champion,28
776,11/8/2020 19:37,NA,"b'If ever @Natarajan_91 gets picked on higher stages please let the chap as is, pace add panna vekkarean muscle power increase panreanu sachi pudadheenga appu..avlo thaan sollitean #IPL2020'",b'parthasarathyv',['IPL2020'],ever get picked higher stage please let chap pace add panna vekkarean muscle power increase panreanu sachi pudadheenga appuavlo thaan sollitean,26
777,11/8/2020 19:37,Chennai,"b""@DelhiCapitals going to the finals for the first time Le me who's been waiting for this moment since 2013 #RoarMacha #DelhiCapitals #dcvsmi #IPL2020 #IPLfinal https://t.co/CipGXNH6iL""",b'imashishbansal',"['RoarMacha', 'DelhiCapitals', 'dcvsmi', 'IPL2020', 'IPLfinal']",going final first time le who waiting moment since,17
778,11/8/2020 19:37,NA,"b""*Everyone's a gangsta until the real gangster enters* #DelhiCapitals\xc2\xa0  watch out  #DCvSRH #MumbaiIndians\xc2\xa0  #MIvsDC  #IPL2020 https://t.co/9uELSTu2DV""",b'Moneyyy_ish',"['DelhiCapitals', 'DCvSRH', 'MumbaiIndians', 'MIvsDC', 'IPL2020']",everyones gangsta real gangster enters watch,12
779,11/8/2020 19:37,Winden ,b'@SunRisers @im_manishpandey you are the jaydev unadkat of sunrisers hyderabad. \xf0\x9f\xa4\xa3  SRH shud pay Kane Williamson that sorta money.   #ManishPandey #IPL2020 #sunrisers #SunrisersHyderabad',b'VJ_618',"['ManishPandey', 'IPL2020', 'sunrisers', 'SunrisersHyderabad']",jaydev unadkat sunrisers hyderabad srh shud pay kane williamson sorta money,17
780,11/8/2020 19:37,"New Delhi, India",b'If Delhi Capitals @DelhiCapitals  open with Rahane &amp; Dhawan and bat second in #IPL2020final they are going to win.I hope they will keep this in mind. Save my tweet.  Do you Agree?   @mipaltan #MIvDC #MIvsDC #DCvsMI #DCvMI #Dream11IPL #IPL2020 #IPLinUAE #IPL #IPLT20 @IPL #DCvSRH',b'Vaibhav19321731',"['IPL2020final', 'MIvDC', 'MIvsDC', 'DCvsMI', 'DCvMI', 'Dream11IPL', 'IPL2020', 'IPLinUAE', 'IPL', 'IPLT20', 'DCvSRH']",delhi capital open rahane dhawan bat second going wini hope keep mind save tweet agree,30
